### ISSUE TITLE
lwaftr end-to-end tests do not handle self-generated icmp dest unreach correctly 

### ISSUE THREAD

**Issue by chrgraf** [Igalia/snabbswitch#607]
Dear all,

kindly need your support.

**summary:**
When running the end-to-end tests with -r option to generate out.pcap and counters,
the generated counters-file does NOT match the generated outv4.pcap for self-generated icmp dest unreachable.
- counters.lua file is correct
- outv4.pcap is empty, but shall contain 2 self-generated icmp dest unreachable

Issue opened, because generated outv4.pcap is empty, while it should contain 2 packets 

**details**

**version**
```
lab@ubuntu1:~/latest-snabb-binary/snabb/src/program/snabbvmx/tests/end-to-end$ git log
commit e13962200c119c0665816672e541491701822bd9
Merge: 459b9a4 b84b46a
Author: Jessica Tallon <xray7224@users.noreply.github.com>
Date:   Wed Nov 30 10:43:32 2016 +0100

    Merge pull request #605 from Igalia/get-state-docs

    Add better documentation for config get-state
```

**running the check to generate counters and out.pcap**
```
$ sudo ./snabb snabbvmx check -r ./snabbvmx-lwaftr-xe1.cfg "./icmp-in-v4.pcap"
   "./empty.pcap" "./outv4.pcap"  "./outv6.pcap" icmp.lua
migrated-snabbvmx-lwaftr-xe1.conf: loading compiled configuration from migrated-snabbvmx-lwaftr-xe1.o
migrated-snabbvmx-lwaftr-xe1.conf: compiled configuration migrated-snabbvmx-lwaftr-xe1.o is up to date.
nh_fwd4: cache_refresh_interval set to 0 seconds
nh_fwd4: static next_hop_mac 90:e2:ba:94:2a:bc
nh_fwd6: cache_refresh_interval set to 0 seconds
nh_fwd6: static next_hop_mac 90:e2:ba:94:2a:bc
done
```

I am feeding 5 packets into the lwaftr and at minimum 2 of them are not matching the binding-table and hence shall trigger the lwaftr to generate icmp-dest unreachable.

**looking at the generated counters file**
The generated icmp.lua looks fully correct and expected.
```
lab@ubuntu1:~/cg-ubuntu1/cg-end-to-end-tests$ cat icmp.lua
return {
   ["drop-all-ipv4-iface-bytes"] = 326,
   ["drop-all-ipv4-iface-packets"] = 3,
   ["drop-in-by-rfc7596-icmpv4-bytes"] = 242,
   ["drop-in-by-rfc7596-icmpv4-packets"] = 1,
   ["drop-no-dest-softwire-ipv4-bytes"] = 326,
   ["drop-no-dest-softwire-ipv4-packets"] = 3,
   ["in-ipv4-bytes"] = 610,
   ["in-ipv4-packets"] = 5,
   ["out-icmpv4-bytes"] = 140,
   ["out-icmpv4-packets"] = 2,
   ["out-ipv4-bytes"] = 140,
   ["out-ipv4-packets"] = 2,     <<, the outv4.pcap shall contain 2 packets
   ["out-ipv6-bytes"] = 364,
   ["out-ipv6-packets"] = 2,
}
```

**looking at the outv4.pcap**
The outv4.pcap shall contain two packets according the counters icmp.lua file. But it is empty instead, hence the issue:
```
lab@ubuntu1:~/cg-ubuntu1/cg-end-to-end-tests$ tcpdump -n -r outv4.pcap
reading from file outv4.pcap, link-type EN10MB (Ethernet)
lab@ubuntu1:~/cg-ubuntu1/cg-end-to-end-tests$
```

**running lwaftr standalone to see the self generated icmp dest unreachable messages**
To better visualize the expected behavior, I have been running lwaftr standalone (not in check mode) to taken a pcap on ingress and egress packets.
It is seen that lwaftr generates 2 * icmp dest unreachable, exactly as the icmp-lua counters-file stated.
```
sudo /home/lab/latest-snabb-binary/snabb/src/snabb lwaftr run --conf migrated-snabbvmx-lwaftr-xe1.conf  --on-a-stick 0000:81:00.1

lab@cgrafubuntu2:~$ sudo tcpdump -n -i p4p1 -e ether host 90:e2:ba:94:2a:bc
tcpdump: verbose output suppressed, use -v or -vv for full protocol decode
listening on p4p1, link-type EN10MB (Ethernet), capture size 262144 bytes

# first frame shows functional lwaftr
05:17:06.412919 90:e2:ba:94:2a:bc > 02:cf:69:15:81:01, ethertype IPv4 (0x0800), length 42: 10.0.1.100.53 > 10.10.0.0.1024: [|domain]
05:17:06.413614 02:cf:69:15:81:01 > 90:e2:ba:94:2a:bc, ethertype IPv6 (0x86dd), length 100: 2a02:587:f700::100 > 2a02:587:f710::40: 10.0.1.100.53 > 10.10.0.0.1024: [|domain]

#second input-frame is not matching binding-table and lwaftr does generate icmp dest unreachable
# this frame shall have been in the outv4.pcap, but it is not
05:17:06.424859 90:e2:ba:94:2a:bc > 02:cf:69:15:81:01, ethertype IPv4 (0x0800), length 42: 10.0.1.100.53 > 10.10.0.0.53: [|domain]
05:17:06.425402 02:cf:69:15:81:01 > 90:e2:ba:94:2a:bc, ethertype IPv4 (0x0800), length 88: 192.168.5.2 > 10.0.1.100: ICMP host 10.10.0.0 unreachable, length 54

# just another valid frame matching the binding-table
05:17:06.437293 90:e2:ba:94:2a:bc > 02:cf:69:15:81:01, ethertype IPv4 (0x0800), length 242: 10.0.1.100 > 10.10.0.0: ICMP echo reply, id 1024, seq 0, length 208
05:17:06.437476 02:cf:69:15:81:01 > 90:e2:ba:94:2a:bc, ethertype IPv6 (0x86dd), length 282: 2a02:587:f700::100 > 2a02:587:f710::40: 10.0.1.100 > 10.10.0.0: ICMP echo reply, id 1024, seq 0, length 208

## ignoring this one, #553 is looking at this
05:17:06.453435 90:e2:ba:94:2a:bc > 02:cf:69:15:81:01, ethertype IPv4 (0x0800), length 242: 10.0.1.100 > 10.10.0.0: ICMP echo reply, id 53, seq 0, length 208

# another frame not matching binding-table and lwaftr generates icmp dest enrich
05:17:06.464803 90:e2:ba:94:2a:bc > 02:cf:69:15:81:01, ethertype IPv4 (0x0800), length 42: 192.168.0.0.53 > 192.168.1.100.1024: [|domain]
05:17:06.465287 02:cf:69:15:81:01 > 90:e2:ba:94:2a:bc, ethertype IPv4 (0x0800), length 88: 192.168.5.2 > 192.168.0.0: ICMP host 192.168.1.100 unreachable, length 54
```

**config**
```
lab@ubuntu1:~/cg-ubuntu1/cg-end-to-end-tests$ cat migrated-snabbvmx-lwaftr-xe1.conf
binding-table {
  br-address 2a02:587:f700::100;
  psid-map {
    addr 10.10.0.0;
    end-addr 10.10.0.1;
    psid-length 6;
    shift 10;
  }
  softwire {
    ipv4 10.10.0.0;
    psid 1;
    b4-ipv6 2a02:587:f710::40;
  }
  softwire {
    ipv4 10.10.0.0;
    psid 2;
    b4-ipv6 2a02:587:f710::41;
  }
}
external-interface {
  error-rate-limiting {
    packets 600000;
  }
  ip 192.168.5.2;
  mac 02:cf:69:15:81:01;
  mtu 9000;
  next-hop {
    mac 90:e2:ba:94:2a:bc;
  }
  reassembly {
    max-fragments-per-packet 40;
  }
}
internal-interface {
  error-rate-limiting {
    packets 600000;
  }
  hairpinning false;
  ip fc00:168:10::2;
  mac 02:cf:69:15:81:01;
  mtu 9000;
  next-hop {
    mac 90:e2:ba:94:2a:bc;
  }
  reassembly {
    max-fragments-per-packet 40;
  }
}
```

**input-pcap**
[inputv4.pcap.gz](https://github.com/Igalia/snabb/files/624504/inputv4.pcap.gz)

Kindly have a look into the issue

thanks

christian

**Comment by dpino** [comment]
Hi @chrgraf 

I cannot reproduce the issue. This is my tip of master:

```
commit bac0239232b2f1eed34772d4cf967d593d7e3185
Merge: e139622 614ed2f
Author: Andy Wingo <wingo@pobox.com>
Date:   Thu Dec 1 17:25:34 2016 +0100

    Merge pull request #606 from Igalia/in-place-update
    
    Restart apps when configuration updated in place
```

With the given input I run:

```bash
sudo ./snabb snabbvmx check -r snabbvmx-lwaftr-xe1.cfg inputv4.pcap \
   empty.pcap ./outv4.pcap ./outv6.pcap counters2.lua
snabbvmx-lwaftr-xe1.conf: loading compiled configuration from snabbvmx-lwaftr-xe1.o
snabbvmx-lwaftr-xe1.conf: compiled configuration snabbvmx-lwaftr-xe1.o is up to date.
nh_fwd4: cache_refresh_interval set to 0 seconds
nh_fwd4: static next_hop_mac 90:e2:ba:94:2a:bc
nh_fwd6: cache_refresh_interval set to 0 seconds
nh_fwd6: static next_hop_mac 90:e2:ba:94:2a:bc
done
```

Then I inspect ./outv4.pcap, and this is what I get:

```bash
$ sudo tcpdump -qns 0 -e -r ./outv4.pcap
reading from file ./outv4.pcap, link-type EN10MB (Ethernet)
00:00:00.000000 02:cf:69:15:81:01 > 90:e2:ba:94:2a:bc, IPv4, length 70: 192.168.10.2 > 10.0.1.100: ICMP host 10.10.0.0 unreachable, length 36
00:00:00.000000 02:cf:69:15:81:01 > 90:e2:ba:94:2a:bc, IPv4, length 70: 192.168.10.2 > 192.168.0.0: ICMP host 192.168.1.100 unreachable, length 36
```

I attach the related config files and pcaps.
[issue-607.tar.gz](https://github.com/Igalia/snabb/files/627126/issue-607.tar.gz)

**Comment by dpino** [comment]
Ping @mwiget. It seems monitoring packets to a mirror interface when SnabbVMX runs inside a docker container is not working correctly. Any thoughts about this?

**Comment by dpino** [comment]
I run the example again using the referred commit in the bug report as tip of branch:

```
commit e13962200c119c0665816672e541491701822bd9
Merge: 459b9a4 b84b46a
Author: Jessica Tallon <xray7224@users.noreply.github.com>
Date:   Wed Nov 30 10:43:32 2016 +0100

    Merge pull request #605 from Igalia/get-state-docs
    
    Add better documentation for config get-state
```

I got two packets in outv4.pcap after running snabbvmx check:

```
$ tcpdump -n -r outv4.pcap 
reading from file outv4.pcap, link-type EN10MB (Ethernet)
00:00:00.000000 IP 192.168.10.2 > 10.0.1.100: ICMP host 10.10.0.0 unreachable, length 36
00:00:00.000000 IP 192.168.10.2 > 192.168.0.0: ICMP host 192.168.1.100 unreachable, length 36
```

However, I noticed the attached input .pcap goes by a different name that the one used in the example (inputv4.pcap vs icmp-in-v4.pcap). Would it be possible the input .pcap file was not correct thus the result differed from what it was expected?

**Comment by chrgraf** [comment]
Hi Diego,

thanks for looking into it. As it is working for you I am wondering what is different in mine setup.
I have downloaded the issue-607.tgz and rerun the test - mine outv4.pcap is still empty while it shall contain 2 packets.
To further reduce complexity, I am now using lwaftr instead of snabbvmx:

**lets make sure we are using identical files**
```
root@ubuntu1:~/issue-607#  for i in *; do md5sum $i; done
ab487d36057d446b6a8b72091da72f23  empty.pcap
1884e63fec8eca6ba0b4a0af6506646c  inputv4.pcap
a424bc44b9d70432cbf3d1d1399c72af  migrated-snabbvmx-lwaftr-xe1.conf
6549d61c8eab557a7a2a32f3240e13c4  migrated-snabbvmx-lwaftr-xe1.o
4e2c9e5db251578c8ac5648b7ecca328  snabb
1a1a75ecc13a03fb750f8d67504dd6fc  snabbvmx-lwaftr-xe1.cfg
2ad02d059e70c75bb868d9f97f48f600  snabbvmx-lwaftr-xe1.conf
```

**used snabb binary**
```
root@ubuntu1:~/latest-snabb-binary/snabb/src# git log
commit e13962200c119c0665816672e541491701822bd9
Merge: 459b9a4 b84b46a
Author: Jessica Tallon <xray7224@users.noreply.github.com>
Date:   Wed Nov 30 10:43:32 2016 +0100

    Merge pull request #605 from Igalia/get-state-docs

    Add better documentation for config get-state

root@ubuntu1:~/latest-snabb-binary/snabb/src# md5sum snabb
4e2c9e5db251578c8ac5648b7ecca328  snabb
```

**running the check**
```
root@ubuntu1:~/issue-607# ./snabb lwaftr  check -r ./migrated-snabbvmx-lwaftr-xe1.conf "./inputv4.pcap" "./empty.pcap" "./outv4-v1.pcap"  "./outv6-v1.pcap" icmp.lua
./migrated-snabbvmx-lwaftr-xe1.conf: loading compiled configuration from ./migrated-snabbvmx-lwaftr-xe1.o
./migrated-snabbvmx-lwaftr-xe1.conf: compiled configuration ./migrated-snabbvmx-lwaftr-xe1.o is up to date.
binding_table	table: 0x40377ea0
external_interface	table: 0x422124c0
internal_interface	table: 0x42213980
done
```

**tcpdump empty - but this shall contain 2 packets**
```
root@ubuntu1:~/issue-607# tcpdump -n -r outv4-v1.pcap
reading from file outv4-v1.pcap, link-type EN10MB (Ethernet)
```

**counters-file does show 2 packets out**
```
root@ubuntu1:~/issue-607# cat icmp.lua
return {
   ["drop-all-ipv4-iface-bytes"] = 326,
   ["drop-all-ipv4-iface-packets"] = 3,
   ["drop-in-by-rfc7596-icmpv4-bytes"] = 242,
   ["drop-in-by-rfc7596-icmpv4-packets"] = 1,
   ["drop-no-dest-softwire-ipv4-bytes"] = 326,
   ["drop-no-dest-softwire-ipv4-packets"] = 3,
   ["in-ipv4-bytes"] = 610,
   ["in-ipv4-frag-reassembly-unneeded"] = 5,
   ["in-ipv4-packets"] = 5,
   ["memuse-ipv4-frag-reassembly-buffer"] = 463571780,
   ["memuse-ipv6-frag-reassembly-buffer"] = 464727376,
   ["out-icmpv4-bytes"] = 140,
   ["out-icmpv4-packets"] = 2,   <<< 2 packets
   ["out-ipv4-bytes"] = 140,
   ["out-ipv4-packets"] = 2,   <<< 2 packets
   ["out-ipv6-bytes"] = 364,
   ["out-ipv6-frag-not"] = 2,
   ["out-ipv6-packets"] = 2,
}
```

**strace**

```
root@ubuntu1:~/issue-607# strace -f -o foo.trace su root -c './snabb lwaftr  check -r ./migrated-snabbvmx-lwaftr-xe1.conf "./inputv4.pcap" "./empty.pcap" "./outv4-v1.pcap"  "./outv6-v1.pcap" icmp.lua'
./migrated-snabbvmx-lwaftr-xe1.conf: loading compiled configuration from ./migrated-snabbvmx-lwaftr-xe1.o
./migrated-snabbvmx-lwaftr-xe1.conf: compiled configuration ./migrated-snabbvmx-lwaftr-xe1.o is up to date.
binding_table	table: 0x408ffea0
external_interface	table: 0x4069c2d8
internal_interface	table: 0x4069de40
done

root@ubuntu1:~/issue-607# less foo.trace | grep pcap
9621  execve("./snabb", ["./snabb", "lwaftr", "check", "-r", "./migrated-snabbvmx-lwaftr-xe1.c"..., "./inputv4.pcap", "./empty.pcap", "./outv4-v1.pcap", "./outv6-v1.pcap", "icmp.lua"], [/* 21 vars */]) = 0
9621  open("./inputv4.pcap", O_RDONLY)  = 3
9621  open("./empty.pcap", O_RDONLY)    = 4
9621  open("./outv4-v1.pcap", O_WRONLY|O_CREAT|O_TRUNC, 0666) = 5
9621  open("./outv6-v1.pcap", O_WRONLY|O_CREAT|O_TRUNC, 0666) = 6
```

**only one write for 5 (outv4-v1.pcap) while the v6-pcap has 3 writes**
```
root@ubuntu1:~/issue-607# grep "write(5" foo.trace
9621  write(5, "\324\303\262\241\2\0\4\0\0\0\0\0\0\0\0\0\377\377\0\0\1\0\0\0", 24) = 24

root@ubuntu1:~/issue-607# grep "write(6" foo.trace
9621  write(6, "\324\303\262\241\2\0\4\0\0\0\0\0\0\0\0\0\377\377\0\0\1\0\0\0", 24) = 24
9621  write(6, "\0\0\0\0\0\0\0\0R\0\0\0R\0\0\0\220\342\272\224*\274\2\317i\25\201\1\206\335`\0"..., 98) = 98
9621  write(6, "\0\0\0\0\0\0\0\0\32\1\0\0\32\1\0\0\220\342\272\224*\274\2\317i\25\201\1\206\335`\0"..., 298) = 298
```

**tarball**
```
 2077  tar -cf issue607-cg.tar issue-607/
 2078  gzip issue607-cg.tar
```

[issue607-cg.tar.gz](https://github.com/Igalia/snabb/files/628190/issue607-cg.tar.gz)


Please let me know what further steps I can do. I can share my screen as well if required.

thanks

christian

**Comment by dpino** [comment]
I tried to reproduce the issue again and I got the same results I got before. ```lwaftr check``` writes 2 IPv4 packets to the output interface.

```
$ grep "write(5" foo.trace 
14218 write(5, "\324\303\262\241\2\0\4\0\0\0\0\0\0\0\0\0\377\377\0\0\1\0\0\0", 24) = 24
14218 write(5, "\0\0\0\0\0\0\0\0F\0\0\0F\0\0\0\220\342\272\224*\274\2\317i\25\201\1\10\0E\0"..., 86) = 86
14218 write(5, "\0\0\0\0\0\0\0\0F\0\0\0F\0\0\0\220\342\272\224*\274\2\317i\25\201\1\10\0E\0"..., 86) = 86
```

I agree on doing a video-chat session to debug the issue together.

**Comment by chrgraf** [comment]
Hi Diego,

I have attached a tarbal, which contains the "run-this.sh" and files I am using including snabb binary.
I have executed this on another ubuntu machine with same results.

can you please check how the "run-this.sh" looks at your side?

'''
juniper@psal-holoplan1:~/igalia/issue-607$ ./run-this.sh
./migrated-snabbvmx-lwaftr-xe1.conf: loading compiled configuration from ./migrated-snabbvmx-lwaftr-xe1.o
./migrated-snabbvmx-lwaftr-xe1.conf: compiled configuration ./migrated-snabbvmx-lwaftr-xe1.o is up to date.
binding_table	table: 0x40fd6690
external_interface	table: 0x40fd98e8
internal_interface	table: 0x40fdb348
done
reading from file /tmp/outv4-v1.pcap, link-type EN10MB (Ethernet)
return {
   ["drop-all-ipv4-iface-bytes"] = 326,
   ["drop-all-ipv4-iface-packets"] = 3,
   ["drop-in-by-rfc7596-icmpv4-bytes"] = 242,
   ["drop-in-by-rfc7596-icmpv4-packets"] = 1,
   ["drop-no-dest-softwire-ipv4-bytes"] = 326,
   ["drop-no-dest-softwire-ipv4-packets"] = 3,
   ["in-ipv4-bytes"] = 610,
   ["in-ipv4-frag-reassembly-unneeded"] = 5,
   ["in-ipv4-packets"] = 5,
   ["memuse-ipv4-frag-reassembly-buffer"] = 463571780,
   ["memuse-ipv6-frag-reassembly-buffer"] = 464727376,
   ["out-icmpv4-bytes"] = 140,
   ["out-icmpv4-packets"] = 2,
   ["out-ipv4-bytes"] = 140,
   ["out-ipv4-packets"] = 2,
   ["out-ipv6-bytes"] = 364,
   ["out-ipv6-frag-not"] = 2,


   ["out-ipv6-packets"] = 2,
}

[issue607-run-this.tar.gz](https://github.com/Igalia/snabb/files/635852/issue607-run-this.tar.gz)


many thanks


christian

**Comment by dpino** [comment]
@chrgraf  Here's the output after running the run-this.sh script:

```
$ ./run-this.sh 
rm: cannot remove ‘/tmp/out*’: No such file or directory
./migrated-snabbvmx-lwaftr-xe1.conf: loading compiled configuration from ./migrated-snabbvmx-lwaftr-xe1.o
./migrated-snabbvmx-lwaftr-xe1.conf: compiled configuration ./migrated-snabbvmx-lwaftr-xe1.o is up to date.
binding_table   table: 0x40269a48
external_interface      table: 0x4151df80
internal_interface      table: 0x4151fec0
hugetlb mmap failed (Cannot allocate memory), falling back.
done
reading from file /tmp/outv4-v1.pcap, link-type EN10MB (Ethernet)
01:00:00.000000 IP 192.168.5.2 > 10.0.1.100: ICMP host 10.10.0.0 unreachable, length 36
01:00:00.000000 IP 192.168.5.2 > 192.168.0.0: ICMP host 192.168.1.100 unreachable, length 36
return {
   ["drop-all-ipv4-iface-bytes"] = 326,
   ["drop-all-ipv4-iface-packets"] = 3,
   ["drop-in-by-rfc7596-icmpv4-bytes"] = 242,
   ["drop-in-by-rfc7596-icmpv4-packets"] = 1,
   ["drop-no-dest-softwire-ipv4-bytes"] = 326,
   ["drop-no-dest-softwire-ipv4-packets"] = 3,
   ["in-ipv4-bytes"] = 610,
   ["in-ipv4-frag-reassembly-unneeded"] = 5,
   ["in-ipv4-packets"] = 5,
   ["memuse-ipv4-frag-reassembly-buffer"] = 463571780,
   ["memuse-ipv6-frag-reassembly-buffer"] = 464727376,
   ["out-icmpv4-bytes"] = 140,
   ["out-icmpv4-packets"] = 2,
   ["out-ipv4-bytes"] = 140,
   ["out-ipv4-frag-not"] = 2,
   ["out-ipv4-packets"] = 2,
   ["out-ipv6-bytes"] = 364,
   ["out-ipv6-frag-not"] = 2,
   ["out-ipv6-packets"] = 2,
}
```

**Comment by dpino** [comment]
I also run it in our snabb servers, which have hugepages enabled. Here's the output:

```
$ ./run-this.sh 
./migrated-snabbvmx-lwaftr-xe1.conf: loading compiled configuration from ./migrated-snabbvmx-lwaftr-xe1.o
./migrated-snabbvmx-lwaftr-xe1.conf: compiled configuration ./migrated-snabbvmx-lwaftr-xe1.o is up to date.
binding_table   table: 0x42166c28
external_interface      table: 0x42169d50
internal_interface      table: 0x4216be78
done
reading from file /tmp/outv4-v1.pcap, link-type EN10MB (Ethernet)
00:00:00.000000 IP 192.168.5.2 > 10.0.1.100: ICMP host 10.10.0.0 unreachable, length 36
00:00:00.000000 IP 192.168.5.2 > 192.168.0.0: ICMP host 192.168.1.100 unreachable, length 36
return {
   ["drop-all-ipv4-iface-bytes"] = 326,
   ["drop-all-ipv4-iface-packets"] = 3,
   ["drop-in-by-rfc7596-icmpv4-bytes"] = 242,
   ["drop-in-by-rfc7596-icmpv4-packets"] = 1,
   ["drop-no-dest-softwire-ipv4-bytes"] = 326,
   ["drop-no-dest-softwire-ipv4-packets"] = 3,
   ["in-ipv4-bytes"] = 610,
   ["in-ipv4-frag-reassembly-unneeded"] = 5,
   ["in-ipv4-packets"] = 5,
   ["memuse-ipv4-frag-reassembly-buffer"] = 463571780,
   ["memuse-ipv6-frag-reassembly-buffer"] = 464727376,
   ["out-icmpv4-bytes"] = 140,
   ["out-icmpv4-packets"] = 2,
   ["out-ipv4-bytes"] = 140,
   ["out-ipv4-frag-not"] = 2,
   ["out-ipv4-packets"] = 2,
   ["out-ipv6-bytes"] = 364,
   ["out-ipv6-frag-not"] = 2,
   ["out-ipv6-packets"] = 2,
}
```

**Comment by dpino** [comment]
Hi Christian,

I want to retake again this issue and hopefully fix it.

I have pushed a remote branch which includes printing debugging message of a packet code path. This is what I get when executing "run-this.sh" in that branch:

```
$ ./run-this.sh 
./migrated-snabbvmx-lwaftr-xe1.conf: loading compiled configuration from ./migrated-snabbvmx-lwaftr-xe1.o
./migrated-snabbvmx-lwaftr-xe1.conf: compiled configuration ./migrated-snabbvmx-lwaftr-xe1.o is up to date.
binding_table   table: 0x41bf1b20
external_interface      table: 0x41bf4b20
internal_interface      table: 0x41bf6830
Packet is ICMPv4
Packet is ICMPv4
Transmit IPv4
Len: 70, data:
000000 90 e2 ba 94 2a bc 02 cf 69 15 81 01 08 00 45 00 
000010 00 38 00 00 00 00 ff 01 ea b6 c0 a8 05 02 0a 00 
000020 01 64 03 01 12 86 00 00 00 00 45 00 00 1c 00 01 
000030 00 00 40 11 65 63 0a 00 01 64 0a 0a 00 00 00 35 
000040 00 35 00 08 ea 06
Transmit IPv4
Len: 70, data:
000000 90 e2 ba 94 2a bc 02 cf 69 15 81 01 08 00 45 00 
000010 00 38 00 00 00 00 ff 01 35 72 c0 a8 05 02 c0 a8 
000020 00 00 03 01 7f cd 00 00 00 00 45 00 00 1c 00 01 
000030 00 00 40 11 f8 1b c0 a8 00 00 c0 a8 01 64 00 35 
000040 04 00 00 08 78 f4
done
reading from file /tmp/outv4-v1.pcap, link-type EN10MB (Ethernet)
00:00:00.000000 IP 192.168.5.2 > 10.0.1.100: ICMP host 10.10.0.0 unreachable, length 36
00:00:00.000000 IP 192.168.5.2 > 192.168.0.0: ICMP host 192.168.1.100 unreachable, length 36
return {
   ["drop-all-ipv4-iface-bytes"] = 326,
   ["drop-all-ipv4-iface-packets"] = 3,
   ["drop-in-by-rfc7596-icmpv4-bytes"] = 242,
   ["drop-in-by-rfc7596-icmpv4-packets"] = 1,
   ["drop-no-dest-softwire-ipv4-bytes"] = 326,
   ["drop-no-dest-softwire-ipv4-packets"] = 3,
   ["in-ipv4-bytes"] = 610,
   ["in-ipv4-frag-reassembly-unneeded"] = 5,
   ["in-ipv4-packets"] = 5,
   ["memuse-ipv4-frag-reassembly-buffer"] = 463571780,
   ["memuse-ipv6-frag-reassembly-buffer"] = 464727376,
   ["out-icmpv4-bytes"] = 140,
   ["out-icmpv4-packets"] = 2,
   ["out-ipv4-bytes"] = 140,
   ["out-ipv4-frag-not"] = 2,
   ["out-ipv4-packets"] = 2,
   ["out-ipv6-bytes"] = 364,
   ["out-ipv6-frag-not"] = 2,
   ["out-ipv6-packets"] = 2,
}
```

The lwAFTR shows it's transmitting two ICMPv4 packets and it prints their payloads too. I want to check if you can see the packet dumps too (likely, I think the problem is on writing the .pcap file).

The remote branch is called issue-607

```
$ git clone -b issue-607 https://github.com/igalia/snabb
```

**Comment by chrgraf** [comment]
Good morning Diego,

thanks for the update. I have taken your branch and rerun the script, output is below.

```
lab@ubuntu1:~/cg-ubuntu1/issue607-new-branch/issue-607$ sudo ./run-this.sh
rm: cannot remove '/tmp/out*': No such file or directory
./migrated-snabbvmx-lwaftr-xe1.conf: loading compiled configuration from ./migrated-snabbvmx-lwaftr-xe1.o
./migrated-snabbvmx-lwaftr-xe1.conf: compiled configuration ./migrated-snabbvmx-lwaftr-xe1.o is up to date.
binding_table	table: 0x40af7148
external_interface	table: 0x41ace0b8
internal_interface	table: 0x41ad0168
[mounting /var/run/snabb/hugetlbfs]
Packet is ICMPv4
Packet is ICMPv4
Transmit IPv4
Len: 70, data:
000000 90 e2 ba 94 2a bc 02 cf 69 15 81 01 08 00 45 00
000010 00 38 00 00 00 00 ff 01 ea b6 c0 a8 05 02 0a 00
000020 01 64 03 01 12 86 00 00 00 00 45 00 00 1c 00 01
000030 00 00 40 11 65 63 0a 00 01 64 0a 0a 00 00 00 35
000040 00 35 00 08 ea 06
Transmit IPv4
Len: 70, data:
000000 90 e2 ba 94 2a bc 02 cf 69 15 81 01 08 00 45 00
000010 00 38 00 00 00 00 ff 01 35 72 c0 a8 05 02 c0 a8
000020 00 00 03 01 7f cd 00 00 00 00 45 00 00 1c 00 01
000030 00 00 40 11 f8 1b c0 a8 00 00 c0 a8 01 64 00 35
000040 04 00 00 08 78 f4
done
reading from file /tmp/outv4-v1.pcap, link-type EN10MB (Ethernet)
return {
   ["drop-all-ipv4-iface-bytes"] = 326,
   ["drop-all-ipv4-iface-packets"] = 3,
   ["drop-in-by-rfc7596-icmpv4-bytes"] = 242,
   ["drop-in-by-rfc7596-icmpv4-packets"] = 1,
   ["drop-no-dest-softwire-ipv4-bytes"] = 326,
   ["drop-no-dest-softwire-ipv4-packets"] = 3,
   ["in-ipv4-bytes"] = 610,
   ["in-ipv4-frag-reassembly-unneeded"] = 5,
   ["in-ipv4-packets"] = 5,
   ["memuse-ipv4-frag-reassembly-buffer"] = 463571780,
   ["memuse-ipv6-frag-reassembly-buffer"] = 464727376,
   ["out-icmpv4-bytes"] = 140,
   ["out-icmpv4-packets"] = 2,
   ["out-ipv4-bytes"] = 140,
   ["out-ipv4-packets"] = 2,
   ["out-ipv6-bytes"] = 364,
   ["out-ipv6-frag-not"] = 2,
   ["out-ipv6-packets"] = 2,
}
```

*md5sum*
```
lab@ubuntu1:~/cg-ubuntu1/issue607-new-branch/issue-607$ grep snabb run-this.sh
sudo /home/lab/cg-ubuntu1/issue607-new-branch/snabb/src/snabb lwaftr  check -r ./migrated-snabbvmx-lwaftr-xe1.conf "./inputv4.pcap" "./empty.pcap" "/tmp/outv4-v1.pcap"  "/tmp/outv6-v1.pcap" icmp.lua

$ md5sum /home/lab/cg-ubuntu1/issue607-new-branch/snabb/src/snabb
8cf50a2dafc0387fe1390c501d054812  /home/lab/cg-ubuntu1/issue607-new-branch/snabb/src/snabb
```

thanks

christian

**Comment by dpino** [comment]
Good, it seems the lwAFTR sends the packet out (something which was highly probably as telling from the counters), but it fails at writing the output to the pcap file.

I updated the branch with a new commit that prints out the links. That will tell us at what point the packets get lost. Just simply `git pull` in your local branch to get it updated and the run make.

This is what my links look like:

```
link report:
                   5 sent on arp.north -> icmpechov4.south (loss rate: 0%)
                   2 sent on arp.south -> icmpechov4.north (loss rate: 0%)
                   5 sent on capturev4.output -> reassemblerv4.input (loss rate: 0%)
                   0 sent on capturev6.output -> reassemblerv6.input (loss rate: 0%)
                   2 sent on fragmenterv4.output -> output_filev4.input (loss rate: 0%)
                   2 sent on fragmenterv6.output -> output_filev6.input (loss rate: 0%)
                   5 sent on icmpechov4.north -> lwaftr.v4 (loss rate: 0%)
                   2 sent on icmpechov4.south -> fragmenterv4.input (loss rate: 0%)
                   0 sent on icmpechov6.north -> lwaftr.v6 (loss rate: 0%)
                   2 sent on icmpechov6.south -> fragmenterv6.input (loss rate: 0%)
                   0 sent on lwaftr.hairpin_out -> lwaftr.hairpin_in (loss rate: 0%)
                   2 sent on lwaftr.v4 -> arp.north (loss rate: 0%)
                   2 sent on lwaftr.v6 -> ndp.north (loss rate: 0%)
                   0 sent on ndp.north -> icmpechov6.south (loss rate: 0%)
                   2 sent on ndp.south -> icmpechov6.north (loss rate: 0%)
                   5 sent on reassemblerv4.output -> arp.south (loss rate: 0%)
                   0 sent on reassemblerv6.output -> ndp.south (loss rate: 0%)
```

The relevant bit is:

```
2 sent on fragmenterv4.output -> output_filev4.input (loss rate: 0%)
```

2 get written to the output .pcap file.

**Comment by chrgraf** [comment]
Hi Diego,

did run the updated snabb:

**git log**
```
lab@ubuntu1:~/cg-ubuntu1/issue607-new-branch/snabb$ git log -1
commit 33871812312be8079e46b2de547fdc8a79dd9acb
Author: Diego Pino Garcia <dpino@igalia.com>
Date:   Wed Jan 4 10:24:53 2017 +0000

    Print out links
```

**permissions of tcpdump**
```
lab@ubuntu1:~/cg-ubuntu1/issue607-new-branch/issue-607$ which tcpdump
/usr/sbin/tcpdump
lab@ubuntu1:~/cg-ubuntu1/issue607-new-branch/issue-607$ ls -ial /usr/sbin/tcpdump
23594309 -rwxr-xr-x 1 root root 1106360 Jun  2  2015 /usr/sbin/tcpdump
```

**tcpdump version**
```
lab@ubuntu1:~/cg-ubuntu1/issue607-new-branch/snabb$ dpkg -l | grep tcpdump
ii  tcpdump                               4.7.4-1ubuntu1                      amd64        command-line network traffic analyzer
ii  tcpreplay                             3.4.4-2                             amd64        Tool to replay saved tcpdump files at arbitrary speeds

lab@ubuntu1:~/cg-ubuntu1/issue607-new-branch/snabb$ uname -a
Linux ubuntu1 4.4.0-51-generic #72-Ubuntu SMP Thu Nov 24 18:29:54 UTC 2016 x86_64 x86_64 x86_64 GNU/Linux

```


**run-this.sh via sudo**
```
lab@ubuntu1:~/cg-ubuntu1/issue607-new-branch/issue-607$ sudo ./run-this.sh
./migrated-snabbvmx-lwaftr-xe1.conf: loading compiled configuration from ./migrated-snabbvmx-lwaftr-xe1.o
./migrated-snabbvmx-lwaftr-xe1.conf: compiled configuration ./migrated-snabbvmx-lwaftr-xe1.o is up to date.
binding_table	table: 0x40f146a8
external_interface	table: 0x40e156d0
internal_interface	table: 0x40e17230
Packet is ICMPv4
Packet is ICMPv4
Transmit IPv4
Len: 70, data:
000000 90 e2 ba 94 2a bc 02 cf 69 15 81 01 08 00 45 00
000010 00 38 00 00 00 00 ff 01 ea b6 c0 a8 05 02 0a 00
000020 01 64 03 01 12 86 00 00 00 00 45 00 00 1c 00 01
000030 00 00 40 11 65 63 0a 00 01 64 0a 0a 00 00 00 35
000040 00 35 00 08 ea 06
Transmit IPv4
Len: 70, data:
000000 90 e2 ba 94 2a bc 02 cf 69 15 81 01 08 00 45 00
000010 00 38 00 00 00 00 ff 01 35 72 c0 a8 05 02 c0 a8
000020 00 00 03 01 7f cd 00 00 00 00 45 00 00 1c 00 01
000030 00 00 40 11 f8 1b c0 a8 00 00 c0 a8 01 64 00 35
000040 04 00 00 08 78 f4
link report:
                   5 sent on arp.north -> icmpechov4.south (loss rate: 0%)
                   0 sent on arp.south -> icmpechov4.north (loss rate: 0%)
                   5 sent on capturev4.output -> reassemblerv4.input (loss rate: 0%)
                   0 sent on capturev6.output -> reassemblerv6.input (loss rate: 0%)
                   0 sent on fragmenterv4.output -> output_filev4.input (loss rate: 0%)
                   2 sent on fragmenterv6.output -> output_filev6.input (loss rate: 0%)
                   5 sent on icmpechov4.north -> lwaftr.v4 (loss rate: 0%)
                   0 sent on icmpechov4.south -> fragmenterv4.input (loss rate: 0%)
                   0 sent on icmpechov6.north -> lwaftr.v6 (loss rate: 0%)
                   2 sent on icmpechov6.south -> fragmenterv6.input (loss rate: 0%)
                   0 sent on lwaftr.hairpin_out -> lwaftr.hairpin_in (loss rate: 0%)
                   2 sent on lwaftr.v4 -> arp.north (loss rate: 0%)
                   2 sent on lwaftr.v6 -> ndp.north (loss rate: 0%)
                   0 sent on ndp.north -> icmpechov6.south (loss rate: 0%)
                   2 sent on ndp.south -> icmpechov6.north (loss rate: 0%)
                   5 sent on reassemblerv4.output -> arp.south (loss rate: 0%)
                   0 sent on reassemblerv6.output -> ndp.south (loss rate: 0%)
done
reading from file /tmp/outv4-v1.pcap, link-type EN10MB (Ethernet)
return {
   ["drop-all-ipv4-iface-bytes"] = 326,
   ["drop-all-ipv4-iface-packets"] = 3,
   ["drop-in-by-rfc7596-icmpv4-bytes"] = 242,
   ["drop-in-by-rfc7596-icmpv4-packets"] = 1,
   ["drop-no-dest-softwire-ipv4-bytes"] = 326,
   ["drop-no-dest-softwire-ipv4-packets"] = 3,
   ["in-ipv4-bytes"] = 610,
   ["in-ipv4-frag-reassembly-unneeded"] = 5,
   ["in-ipv4-packets"] = 5,
   ["memuse-ipv4-frag-reassembly-buffer"] = 463571780,
   ["memuse-ipv6-frag-reassembly-buffer"] = 464727376,
   ["out-icmpv4-bytes"] = 140,
   ["out-icmpv4-packets"] = 2,
   ["out-ipv4-bytes"] = 140,
   ["out-ipv4-packets"] = 2,
   ["out-ipv6-bytes"] = 364,
   ["out-ipv6-frag-not"] = 2,
   ["out-ipv6-packets"] = 2,
}
```

**run-this.sh via explicit root**
```
lab@ubuntu1:~/cg-ubuntu1/issue607-new-branch/snabb$ sudo -s
root@ubuntu1:~/cg-ubuntu1/issue607-new-branch/snabb# id
uid=0(root) gid=0(root) groups=0(root)

root@ubuntu1:~/cg-ubuntu1/issue607-new-branch/snabb# cd ../issue-607/
root@ubuntu1:~/cg-ubuntu1/issue607-new-branch/issue-607# ./run-this.sh
./migrated-snabbvmx-lwaftr-xe1.conf: loading compiled configuration from ./migrated-snabbvmx-lwaftr-xe1.o
./migrated-snabbvmx-lwaftr-xe1.conf: compiled configuration ./migrated-snabbvmx-lwaftr-xe1.o is up to date.
binding_table	table: 0x40841030
external_interface	table: 0x417637d0
internal_interface	table: 0x423b1cc8
Packet is ICMPv4
Packet is ICMPv4
Transmit IPv4
Len: 70, data:
000000 90 e2 ba 94 2a bc 02 cf 69 15 81 01 08 00 45 00
000010 00 38 00 00 00 00 ff 01 ea b6 c0 a8 05 02 0a 00
000020 01 64 03 01 12 86 00 00 00 00 45 00 00 1c 00 01
000030 00 00 40 11 65 63 0a 00 01 64 0a 0a 00 00 00 35
000040 00 35 00 08 ea 06
Transmit IPv4
Len: 70, data:
000000 90 e2 ba 94 2a bc 02 cf 69 15 81 01 08 00 45 00
000010 00 38 00 00 00 00 ff 01 35 72 c0 a8 05 02 c0 a8
000020 00 00 03 01 7f cd 00 00 00 00 45 00 00 1c 00 01
000030 00 00 40 11 f8 1b c0 a8 00 00 c0 a8 01 64 00 35
000040 04 00 00 08 78 f4
link report:
                   5 sent on arp.north -> icmpechov4.south (loss rate: 0%)
                   0 sent on arp.south -> icmpechov4.north (loss rate: 0%)
                   5 sent on capturev4.output -> reassemblerv4.input (loss rate: 0%)
                   0 sent on capturev6.output -> reassemblerv6.input (loss rate: 0%)
                   0 sent on fragmenterv4.output -> output_filev4.input (loss rate: 0%)
                   2 sent on fragmenterv6.output -> output_filev6.input (loss rate: 0%)
                   5 sent on icmpechov4.north -> lwaftr.v4 (loss rate: 0%)
                   0 sent on icmpechov4.south -> fragmenterv4.input (loss rate: 0%)
                   0 sent on icmpechov6.north -> lwaftr.v6 (loss rate: 0%)
                   2 sent on icmpechov6.south -> fragmenterv6.input (loss rate: 0%)
                   0 sent on lwaftr.hairpin_out -> lwaftr.hairpin_in (loss rate: 0%)
                   2 sent on lwaftr.v4 -> arp.north (loss rate: 0%)
                   2 sent on lwaftr.v6 -> ndp.north (loss rate: 0%)
                   0 sent on ndp.north -> icmpechov6.south (loss rate: 0%)
                   2 sent on ndp.south -> icmpechov6.north (loss rate: 0%)
                   5 sent on reassemblerv4.output -> arp.south (loss rate: 0%)
                   0 sent on reassemblerv6.output -> ndp.south (loss rate: 0%)
done
reading from file /tmp/outv4-v1.pcap, link-type EN10MB (Ethernet)
return {
   ["drop-all-ipv4-iface-bytes"] = 326,
   ["drop-all-ipv4-iface-packets"] = 3,
   ["drop-in-by-rfc7596-icmpv4-bytes"] = 242,
   ["drop-in-by-rfc7596-icmpv4-packets"] = 1,
   ["drop-no-dest-softwire-ipv4-bytes"] = 326,
   ["drop-no-dest-softwire-ipv4-packets"] = 3,
   ["in-ipv4-bytes"] = 610,
   ["in-ipv4-frag-reassembly-unneeded"] = 5,
   ["in-ipv4-packets"] = 5,
   ["memuse-ipv4-frag-reassembly-buffer"] = 463571780,
   ["memuse-ipv6-frag-reassembly-buffer"] = 464727376,
   ["out-icmpv4-bytes"] = 140,
   ["out-icmpv4-packets"] = 2,
   ["out-ipv4-bytes"] = 140,
   ["out-ipv4-packets"] = 2,
   ["out-ipv6-bytes"] = 364,
   ["out-ipv6-frag-not"] = 2,
   ["out-ipv6-packets"] = 2,
}
```

**md5sum**
```
lab@ubuntu1:~/cg-ubuntu1/issue607-new-branch/snabb$ md5sum /home/lab/cg-ubuntu1/issue607-new-branch/snabb/src/snabb
d1657db4f1f4054aecab118cc2f859d4  /home/lab/cg-ubuntu1/issue607-new-branch/snabb/src/snabb
```

thanks

christian

**Comment by dpino** [comment]
I ordered the links. Basically, the packets start at capturev4.output and they are pass down to an input link in one app and that one passes the packet down to another app via an output link.

**Diego**

```
5 sent on capturev4.output -> reassemblerv4.input (loss rate: 0%)
0 sent on capturev6.output -> reassemblerv6.input (loss rate: 0%)
5 sent on reassemblerv4.output -> arp.south (loss rate: 0%)
0 sent on reassemblerv6.output -> ndp.south (loss rate: 0%)
5 sent on arp.north -> icmpechov4.south (loss rate: 0%)
0 sent on ndp.north -> icmpechov6.south (loss rate: 0%)
5 sent on icmpechov4.north -> lwaftr.v4 (loss rate: 0%)
0 sent on icmpechov6.north -> lwaftr.v6 (loss rate: 0%)
2 sent on lwaftr.v4 -> arp.north (loss rate: 0%)
2 sent on lwaftr.v6 -> ndp.north (loss rate: 0%)
2 sent on arp.south -> icmpechov4.north (loss rate: 0%)
2 sent on ndp.south -> icmpechov6.north (loss rate: 0%)
2 sent on icmpechov4.south -> fragmenterv4.input (loss rate: 0%)
2 sent on icmpechov6.south -> fragmenterv6.input (loss rate: 0%)
2 sent on fragmenterv4.output -> output_filev4.input (loss rate: 0%)
2 sent on fragmenterv6.output -> output_filev6.input (loss rate: 0%)
```

**Christian**

```
5 sent on capturev4.output -> reassemblerv4.input (loss rate: 0%)
0 sent on capturev6.output -> reassemblerv6.input (loss rate: 0%)
5 sent on reassemblerv4.output -> arp.south (loss rate: 0%)
0 sent on reassemblerv6.output -> ndp.south (loss rate: 0%)
5 sent on arp.north -> icmpechov4.south (loss rate: 0%)
0 sent on ndp.north -> icmpechov6.south (loss rate: 0%)
5 sent on icmpechov4.north -> lwaftr.v4 (loss rate: 0%)
0 sent on icmpechov6.north -> lwaftr.v6 (loss rate: 0%)
2 sent on lwaftr.v4 -> arp.north (loss rate: 0%)
2 sent on lwaftr.v6 -> ndp.north (loss rate: 0%)
0 sent on arp.south -> icmpechov4.north (loss rate: 0%)
2 sent on ndp.south -> icmpechov6.north (loss rate: 0%)
0 sent on icmpechov4.south -> fragmenterv4.input (loss rate: 0%)
2 sent on icmpechov6.south -> fragmenterv6.input (loss rate: 0%)
0 sent on fragmenterv4.output -> output_filev4.input (loss rate: 0%)
2 sent on fragmenterv6.output -> output_filev6.input (loss rate: 0%)
```

It seems there's a problem in the ARP application. In your case, the 2 packets coming out from the lwAFTR get lost when they arrive to the ARP app.

```
2 sent on lwaftr.v4 -> arp.north (loss rate: 0%)
0 sent on arp.south -> icmpechov4.north (loss rate: 0%)
```

Now I just need to struggle my head a bit to figure out why is working in my case and not yours when our binary and configuration files are exactly the same :)

**Comment by dpino** [comment]
I think I figured out what happened.

In your issue-607 directory you have a `migrated-snabbvmx-lwaftr-xe1.o` file. This is a compiled lwAFTR configuration file. Try to remove it and execute `./run-this.sh`, that will read `migrated-snabbvmx-lwaftr-xe1.conf` and compile it to a new .o file. I think the problem was that the .o you have in your directory was compiled with an old version of snabb (at least different than the one you're using).

Actually, I did what I described above and it fixed the issue:

1. Downloaded https://github.com/Igalia/snabb/files/635852/issue607-run-this.tar.gz
2. Execute ./run-this.sh:

```
$ ./run-this.sh 
rm: cannot remove ‘/tmp/out*’: No such file or directory
./migrated-snabbvmx-lwaftr-xe1.conf: loading compiled configuration from ./migrated-snabbvmx-lwaftr-xe1.o
./migrated-snabbvmx-lwaftr-xe1.conf: compiled configuration ./migrated-snabbvmx-lwaftr-xe1.o is up to date.
binding_table   table: 0x40b71fb0
external_interface      table: 0x40b75390
internal_interface      table: 0x40b76df0
hugetlb mmap failed (Cannot allocate memory), falling back.
done
reading from file /tmp/outv4-v1.pcap, link-type EN10MB (Ethernet)
return {
   ["drop-all-ipv4-iface-bytes"] = 326,
   ["drop-all-ipv4-iface-packets"] = 3,
   ["drop-in-by-rfc7596-icmpv4-bytes"] = 242,
   ["drop-in-by-rfc7596-icmpv4-packets"] = 1,
   ["drop-no-dest-softwire-ipv4-bytes"] = 326,
   ["drop-no-dest-softwire-ipv4-packets"] = 3,
   ["in-ipv4-bytes"] = 610,
   ["in-ipv4-frag-reassembly-unneeded"] = 5,
   ["in-ipv4-packets"] = 5,
   ["memuse-ipv4-frag-reassembly-buffer"] = 463571780,
   ["memuse-ipv6-frag-reassembly-buffer"] = 464727376,
   ["out-icmpv4-bytes"] = 140,
   ["out-icmpv4-packets"] = 2,
   ["out-ipv4-bytes"] = 140,
   ["out-ipv4-packets"] = 2,
   ["out-ipv6-bytes"] = 364,
   ["out-ipv6-frag-not"] = 2,
   ["out-ipv6-packets"] = 2,
}
```

3. Removed `./migrated-snabbvmx-lwaftr-xe1.o` and run it again:

```
$ ./run-this.sh 
./migrated-snabbvmx-lwaftr-xe1.conf: loading source configuration from ./migrated-snabbvmx-lwaftr-xe1.conf
binding_table   table: 0x40193da0
external_interface      table: 0x401976f0
internal_interface      table: 0x40198f90
hugetlb mmap failed (Cannot allocate memory), falling back.
done
reading from file /tmp/outv4-v1.pcap, link-type EN10MB (Ethernet)
01:00:00.000000 IP 192.168.5.2 > 10.0.1.100: ICMP host 10.10.0.0 unreachable, length 36
01:00:00.000000 IP 192.168.5.2 > 192.168.0.0: ICMP host 192.168.1.100 unreachable, length 36
return {
   ["drop-all-ipv4-iface-bytes"] = 326,
   ["drop-all-ipv4-iface-packets"] = 3,
   ["drop-in-by-rfc7596-icmpv4-bytes"] = 242,
   ["drop-in-by-rfc7596-icmpv4-packets"] = 1,
   ["drop-no-dest-softwire-ipv4-bytes"] = 326,
   ["drop-no-dest-softwire-ipv4-packets"] = 3,
   ["in-ipv4-bytes"] = 610,
   ["in-ipv4-frag-reassembly-unneeded"] = 5,
   ["in-ipv4-packets"] = 5,
   ["memuse-ipv4-frag-reassembly-buffer"] = 463571780,
   ["memuse-ipv6-frag-reassembly-buffer"] = 464727376,
   ["out-icmpv4-bytes"] = 140,
   ["out-icmpv4-packets"] = 2,
   ["out-ipv4-bytes"] = 140,
   ["out-ipv4-frag-not"] = 2,
   ["out-ipv4-packets"] = 2,
   ["out-ipv6-bytes"] = 364,
   ["out-ipv6-frag-not"] = 2,
   ["out-ipv6-packets"] = 2,
}
```

**Comment by chrgraf** [comment]
Hi Diego,

thanks for this further analysis. I did follow your steps, but is not solving the issue:


**checking the directory contents**
```
lab@ubuntu1:~/cg-ubuntu1/issue607-new-branch/issue-607$ ls -ial
total 352
2630027 drwxr-xr-x 2 lab  lab    4096 Jan  4 23:41 .
2104994 drwxrwxr-x 4 lab  lab    4096 Jan  4 12:33 ..
2630038 -rw-r--r-- 1 lab  lab      24 Dec  2 13:20 empty.pcap
2630032 -rw-r--r-- 1 lab  lab  308253 Dec  2 21:24 foo.trace
2630035 -rw-r--r-- 1 root root    696 Jan  4 23:41 icmp.lua
2630034 -rw-r--r-- 1 lab  lab     714 Dec  2 13:20 inputv4.pcap
2630041 -rw-r--r-- 1 lab  lab     773 Dec  2 20:36 migrated-snabbvmx-lwaftr-xe1.conf
2630028 -rw-r--r-- 1 lab  lab    1769 Dec  7 07:10 migrated-snabbvmx-lwaftr-xe1.o
2630033 -rw-r--r-- 1 lab  lab      24 Dec  2 21:24 outv4-v1.pcap
2630037 -rw-r--r-- 1 lab  lab     420 Dec  2 21:24 outv6-v1.pcap
2630039 -rwxrwxr-x 1 lab  lab     242 Dec  7 07:16 run-this.sh
2630036 lrwxrwxrwx 1 lab  lab      18 Jan  4 23:41 snabb -> ../snabb/src/snabb  << symlink to your new binary
2630029 -rw-r--r-- 1 lab  lab     455 Dec  2 13:20 snabbvmx-lwaftr-xe1.cfg
2630031 -rw-r--r-- 1 lab  lab     988 Dec  2 13:20 snabbvmx-lwaftr-xe1.conf
```
Note: removing the symlink and copying snabb binary directly was tried as well. no difference.

md5sum of snabb binary in use
```
lab@ubuntu1:~/cg-ubuntu1/issue607-new-branch/issue-607$ md5sum snabb
d1657db4f1f4054aecab118cc2f859d4  snabb
```

removing the .o file as suggested by you
```
lab@ubuntu1:~/cg-ubuntu1/issue607-new-branch/issue-607$ rm -rf migrated-snabbvmx-lwaftr-xe1.o
lab@ubuntu1:~/cg-ubuntu1/issue607-new-branch/issue-607$ ls -ial migrated-snabbvmx-lwaftr-xe1.o
ls: cannot access 'migrated-snabbvmx-lwaftr-xe1.o': No such file or directory
```


**running the script**
```
lab@ubuntu1:~/cg-ubuntu1/issue607-new-branch/issue-607$ sudo ./run-this.sh
./migrated-snabbvmx-lwaftr-xe1.conf: loading source configuration from ./migrated-snabbvmx-lwaftr-xe1.conf
binding_table	table: 0x40f9bde8
external_interface	table: 0x402b6580
internal_interface	table: 0x402b7e20
Packet is ICMPv4
Packet is ICMPv4
Transmit IPv4
Len: 70, data:
000000 90 e2 ba 94 2a bc 02 cf 69 15 81 01 08 00 45 00
000010 00 38 00 00 00 00 ff 01 ea b6 c0 a8 05 02 0a 00
000020 01 64 03 01 12 86 00 00 00 00 45 00 00 1c 00 01
000030 00 00 40 11 65 63 0a 00 01 64 0a 0a 00 00 00 35
000040 00 35 00 08 ea 06
Transmit IPv4
Len: 70, data:
000000 90 e2 ba 94 2a bc 02 cf 69 15 81 01 08 00 45 00
000010 00 38 00 00 00 00 ff 01 35 72 c0 a8 05 02 c0 a8
000020 00 00 03 01 7f cd 00 00 00 00 45 00 00 1c 00 01
000030 00 00 40 11 f8 1b c0 a8 00 00 c0 a8 01 64 00 35
000040 04 00 00 08 78 f4
link report:
                   5 sent on arp.north -> icmpechov4.south (loss rate: 0%)
                   0 sent on arp.south -> icmpechov4.north (loss rate: 0%)
                   5 sent on capturev4.output -> reassemblerv4.input (loss rate: 0%)
                   0 sent on capturev6.output -> reassemblerv6.input (loss rate: 0%)
                   0 sent on fragmenterv4.output -> output_filev4.input (loss rate: 0%)
                   2 sent on fragmenterv6.output -> output_filev6.input (loss rate: 0%)
                   5 sent on icmpechov4.north -> lwaftr.v4 (loss rate: 0%)
                   0 sent on icmpechov4.south -> fragmenterv4.input (loss rate: 0%)
                   0 sent on icmpechov6.north -> lwaftr.v6 (loss rate: 0%)
                   2 sent on icmpechov6.south -> fragmenterv6.input (loss rate: 0%)
                   0 sent on lwaftr.hairpin_out -> lwaftr.hairpin_in (loss rate: 0%)
                   2 sent on lwaftr.v4 -> arp.north (loss rate: 0%)
                   2 sent on lwaftr.v6 -> ndp.north (loss rate: 0%)
                   0 sent on ndp.north -> icmpechov6.south (loss rate: 0%)
                   2 sent on ndp.south -> icmpechov6.north (loss rate: 0%)
                   5 sent on reassemblerv4.output -> arp.south (loss rate: 0%)
                   0 sent on reassemblerv6.output -> ndp.south (loss rate: 0%)
done
reading from file /tmp/outv4-v1.pcap, link-type EN10MB (Ethernet)
return {
   ["drop-all-ipv4-iface-bytes"] = 326,
   ["drop-all-ipv4-iface-packets"] = 3,
   ["drop-in-by-rfc7596-icmpv4-bytes"] = 242,
   ["drop-in-by-rfc7596-icmpv4-packets"] = 1,
   ["drop-no-dest-softwire-ipv4-bytes"] = 326,
   ["drop-no-dest-softwire-ipv4-packets"] = 3,
   ["in-ipv4-bytes"] = 610,
   ["in-ipv4-frag-reassembly-unneeded"] = 5,
   ["in-ipv4-packets"] = 5,
   ["memuse-ipv4-frag-reassembly-buffer"] = 463571780,
   ["memuse-ipv6-frag-reassembly-buffer"] = 464727376,
   ["out-icmpv4-bytes"] = 140,
   ["out-icmpv4-packets"] = 2,
   ["out-ipv4-bytes"] = 140,
   ["out-ipv4-packets"] = 2,
   ["out-ipv6-bytes"] = 364,
   ["out-ipv6-frag-not"] = 2,
   ["out-ipv6-packets"] = 2,
}
```

**script is unmodified from the tarball**
```
lab@ubuntu1:~/cg-ubuntu1/issue607-new-branch/issue-607$ cat run-this.sh
#!/bin/sh
sudo rm /tmp/out*
sudo rm icmp.lua
sudo ./snabb lwaftr  check -r ./migrated-snabbvmx-lwaftr-xe1.conf "./inputv4.pcap" "./empty.pcap" "/tmp/outv4-v1.pcap"  "/tmp/outv6-v1.pcap" icmp.lua
tcpdump -n -r /tmp/outv4-v1.pcap
cat icmp.lua
```

**md5sum of script**
```
lab@ubuntu1:~/cg-ubuntu1/issue607-new-branch/issue-607$ md5sum run-this.sh
82c52929991898926334e1e9804e317e  run-this.sh
```

thanks

christian

**Comment by dpino** [comment]
Thanks Christian. It seems I got a false positive. Now I don't manage to reproduce it as I told you, sorry for wasting your time.

I need to continue investigating. I think we should focus in `lwaftr-snabbvmx` branch, which is the branch vmx-docker-lwaftr is based. And also try this test in the latest commit of the lwaftr branch. I'm going to try those use cases.

**Comment by dpino** [comment]
After exploring the issue over remote desktop with @chrgraf , we found out:

- The issue happens intermittently in lwaftr branch. I was finally able to reproduce it in my desktop too.
- The issue doesn't happen lwaftr-snabbvmx branch, neither in my desktop or Christian's machine.

Thus, we agree to mark the issue as solved as `lwaftr-snabbvmx` branch is more relevant for Christian's case and open a new ticket to handle the issue in `lwaftr` branch (#698) as it seems to be a bug.
