### ISSUE TITLE
end-to-end.sh tests inconsistent counters

### ISSUE THREAD

**Issue by chrgraf** [Igalia/snabbswitch#542]
Dear all,

the counters for "out-ipv[46]-packets within the end-to-end tests are non-consistent.

For out-ipv6-packets it does **_not_** count self-generated out-icmpv6-packets.
For out-ipv4-packets it does count the self-generated icmpv4 packets.

Not sure if this relates to issue #533 

example
=======
```
lab@ubuntu1:~/latest-snabb-binary/snabb/src/program/snabbvmx/tests/end-to-end/data$ sudo ~/latest-snabb-binary/snabb/src/snabb snabbvmx check -r  ./icmp_snabbvmx-lwaftr-xe1.cfg "./icmp-ipv4-in.pcap" "./icmp-ipv6-in.pcap" "./outv4/outv4.pcap" "./outv6/outv6.pcap" icmp.lua
```
As we can see in below generated counters file we have 2 * IPv6 packets out and 4 * IPv4 packets out
```
lab@ubuntu1:~/latest-snabb-binary/snabb/src/program/snabbvmx/tests/end-to-end/data$ cat icmp.lua  | grep out | grep pack
   ["out-icmpv4-packets"] = 2,
   ["out-icmpv6-packets"] = 3,
   ["out-ipv4-packets"] = 4,
   ["out-ipv6-packets"] = 2,
```

**out-ipv4-packets counts ICMP dst unreachable**
We do see 4 packets out, 2 * plain IPv4 and 2 * self-generated icmp dst unreachable.
So the counter out-ipv4-packets includes out-icmpv4-packets.
```
lab@ubuntu1:~/latest-snabb-binary/snabb/src/program/snabbvmx/tests/end-to-end/data$ tcpdump -r outv4/outv4.pcap
reading from file outv4/outv4.pcap, link-type EN10MB (Ethernet)
01:00:00.000000 IP 10.10.0.0.1024 > 10.0.1.100.domain: [|domain]
01:00:00.000000 IP 10.10.0.0 > 10.0.1.100: ICMP echo request, id 1024, seq 0, length 208
01:00:00.000000 IP 192.168.10.2 > 10.0.1.100: ICMP host 10.10.0.0 unreachable, length 36
01:00:00.000000 IP 192.168.10.2 > 192.168.0.0: ICMP host 192.168.1.100 unreachable, length 36
```

**out-ipv6-packets do NOT include ICMP dst unreachable**
In above counter-file, out-ipv6-packets claims only 2 packets. However, as we can see we do have 5 packets outgoing.
This is different to the out-ipv4-packets, as for out-ipv6-packets it does not count out-icmpv6-packets.

```
lab@ubuntu1:~/latest-snabb-binary/snabb/src/program/snabbvmx/tests/end-to-end/data$ tcpdump -r outv6/outv6.pcap
reading from file outv6/outv6.pcap, link-type EN10MB (Ethernet)
01:00:00.000000 IP6 2a02:587:f700::100 > 2a02:587:f710::40: ICMP6, destination unreachable, unknown unreach code (5)
	0x0000:  0105 12d7 0000 0000 6000 0000 001c 0440
	0x0010:  2a02 0587 f710 0000 0000 0000 0000 0040
	0x0020:  2a02 0587 f700 0000 0000 0000 0000 0100
	0x0030:  4500 001c 0001 0000 4011 6563 0a0a 0000
	0x0040:  0a00 0164 0035 0035 0008 ea06
01:00:00.000000 IP6 2a02:587:f700::100 > 2a02:587:f710::40: ICMP6, destination unreachable, unknown unreach code (5)
	0x0000:  0105 fbbf 0000 0000 6000 0000 00e4 0440
	0x0010:  2a02 0587 f710 0000 0000 0000 0000 0040
	0x0020:  2a02 0587 f700 0000 0000 0000 0000 0100
	0x0030:  4500 00e4 0001 0000 4001 64ab 0a0a 0000
	0x0040:  0a00 0164 0800 edc0 0035 0000 6161 6161
	0x0050:  6161 6161 6161 6161 6161 6161 6161 6161
	0x0060:  6161 6161 6161 6161 6161 6161 6161 6161
	0x0070:  6161 6161 6161 6161 6161 6161 6161 6161
	0x0080:  6161 6161 6161 6161 6161 6161 6161 6161
	0x0090:  6161 6161 6161 6161 6161 6161 6161 6161
	0x00a0:  6161 6161 6161 6161 6161 6161 6161 6161
	0x00b0:  6161 6161 6161 6161 6161 6161 6161 6161
	0x00c0:  6161 6161 6161 6161 6161 6161 6161 6161
	0x00d0:  6161 6161 6161 6161 6161 6161 6161 6161
	0x00e0:  6161 6161 6161 6161 6161 6161 6161 6161
	0x00f0:  6161 6161 6161 6161 6161 6161 6161 6161
	0x0100:  6161 6161 6161 6161 6161 6161 6161 6161
	0x0110:  6161 6161
01:00:00.000000 IP6 2a02:587:f700::100 > 2a02:587:f710::40: ICMP6, destination unreachable, unknown unreach code (5)
	0x0000:  0105 fbbf 0000 0000 6000 0000 00e4 0440
	0x0010:  2a02 0587 f710 0000 0000 0000 0000 0040
	0x0020:  2a02 0587 f700 0000 0000 0000 0000 0100
	0x0030:  4500 00e4 0001 0000 4001 f763 c0a8 0000
	0x0040:  c0a8 0164 0800 e9f5 0400 0000 6161 6161
	0x0050:  6161 6161 6161 6161 6161 6161 6161 6161
	0x0060:  6161 6161 6161 6161 6161 6161 6161 6161
	0x0070:  6161 6161 6161 6161 6161 6161 6161 6161
	0x0080:  6161 6161 6161 6161 6161 6161 6161 6161
	0x0090:  6161 6161 6161 6161 6161 6161 6161 6161
	0x00a0:  6161 6161 6161 6161 6161 6161 6161 6161
	0x00b0:  6161 6161 6161 6161 6161 6161 6161 6161
	0x00c0:  6161 6161 6161 6161 6161 6161 6161 6161
	0x00d0:  6161 6161 6161 6161 6161 6161 6161 6161
	0x00e0:  6161 6161 6161 6161 6161 6161 6161 6161
	0x00f0:  6161 6161 6161 6161 6161 6161 6161 6161
	0x0100:  6161 6161 6161 6161 6161 6161 6161 6161
	0x0110:  6161 6161
01:00:00.000000 IP6 2a02:587:f700::100 > 2a02:587:f710::40: IP 10.0.1.100.domain > 10.10.0.0.1024: [|domain]
01:00:00.000000 IP6 2a02:587:f700::100 > 2a02:587:f710::40: IP 10.0.1.100 > 10.10.0.0: ICMP echo reply, id 1024, seq 0, length 208
```

**summary**
please make sure that both counters behave the same, which is to either include or both exclude in their packet-count the number of self-generated icmp-messages.

Many thanks

christian

**how to reproduce**
```
lab@ubuntu1:~/latest-snabb-binary/snabb/src/program/snabbvmx/tests/end-to-end/data$ cat cg-binding_table.txt.s
psid_map {
  10.10.0.0  {psid_length=6, shift=10}
  10.10.0.1  {psid_length=6, shift=10}
  10.10.0.10 {psid_length=6, shift=10}
}
br_addresses {
  2a02:587:f700::100,
}
softwires {
  { ipv4=10.10.0.0, psid=1, b4=2a02:587:f710::40 }
  { ipv4=10.10.0.0, psid=2, b4=2a02:587:f710::41 }
  { ipv4=10.10.0.0, psid=3, b4=2a02:587:f710::42 }
  { ipv4=10.10.0.0, psid=4, b4=2a02:587:f710::43 }
}

lab@ubuntu1:~/latest-snabb-binary/snabb/src/program/snabbvmx/tests/end-to-end/data$ cat icmp_snabbvmx-lwaftr-xe1.cfg
return {
  lwaftr = "icmp_snabbvmx-lwaftr-xe1.conf",
  settings = {
  },
  ipv6_interface = {
    ipv6_address = "",
    cache_refresh_interval = 0,
    fragmentation = false,
    mac_address = "02:cf:69:15:81:01",
    next_hop_mac = "90:e2:ba:94:2a:bc",
  },
  ipv4_interface = {
    ipv4_address = "192.168.5.2",
    cache_refresh_interval = 0,
    fragmentation = false,
    mac_address = "02:cf:69:15:81:01",
    next_hop_mac = "90:e2:ba:94:2a:bc",
  },
}

lab@ubuntu1:~/latest-snabb-binary/snabb/src/program/snabbvmx/tests/end-to-end/data$ cat icmp_snabbvmx-lwaftr-xe1.conf
hairpinning = false,
vlan_tagging = false,
binding_table = cg-binding_table.txt.s,
aftr_ipv6_ip = fc00:168:10::2,
aftr_ipv4_ip = 192.168.10.2,
aftr_mac_inet_side = 02:cf:69:15:81:01,
inet_mac = 90:e2:ba:94:2a:bc
aftr_mac_b4_side = 02:cf:69:15:81:01,
next_hop6_mac = 90:e2:ba:94:2a:bc,
ipv4_mtu = 9000,
ipv6_mtu = 9000,
policy_icmpv4_incoming = allow,
policy_icmpv4_outgoing = allow,
policy_icmpv6_incoming = allow,
policy_icmpv6_outgoing = allow,
icmpv6_rate_limiter_n_packets = 300000,
icmpv6_rate_limiter_n_seconds = 4,

lab@ubuntu1:~/latest-snabb-binary/snabb/src/program/snabbvmx/tests/end-to-end/data$ cat icmp.lua
return {
   ["drop-all-ipv4-iface-bytes"] = 568,
   ["drop-all-ipv4-iface-packets"] = 4,
   ["drop-all-ipv6-iface-bytes"] = 646,
   ["drop-all-ipv6-iface-packets"] = 3,
   ["drop-in-by-rfc7596-icmpv4-bytes"] = 484,
   ["drop-in-by-rfc7596-icmpv4-packets"] = 2,
   ["drop-no-dest-softwire-ipv4-bytes"] = 568,
   ["drop-no-dest-softwire-ipv4-packets"] = 4,
   ["drop-no-source-softwire-ipv6-bytes"] = 646,
   ["drop-no-source-softwire-ipv6-packets"] = 3,
   ["in-ipv4-bytes"] = 852,
   ["in-ipv4-packets"] = 6,
   ["in-ipv6-bytes"] = 1010,
   ["in-ipv6-packets"] = 5,
   ["out-icmpv4-bytes"] = 140,
   ["out-icmpv4-packets"] = 2,
   ["out-icmpv6-bytes"] = 790,
   ["out-icmpv6-packets"] = 3,
   ["out-ipv4-bytes"] = 424,
   ["out-ipv4-packets"] = 4,
   ["out-ipv6-bytes"] = 364,
   ["out-ipv6-packets"] = 2,
}
```

**the caps**
IPv4
```
lab@ubuntu1:~/latest-snabb-binary/snabb/src/program/snabbvmx/tests/end-to-end/data$ tcpdump -n -e -r icmp-ipv4-in.pcap
reading from file icmp-ipv4-in.pcap, link-type EN10MB (Ethernet)
11:27:10.976929 90:e2:ba:94:2a:bc > 02:cf:69:15:81:01, ethertype IPv4 (0x0800), length 42: 10.0.1.100.53 > 10.10.0.0.1024: [|domain]
11:27:10.988846 90:e2:ba:94:2a:bc > 02:cf:69:15:81:01, ethertype IPv4 (0x0800), length 42: 10.0.1.100.53 > 10.10.0.0.53: [|domain]
11:27:11.001278 90:e2:ba:94:2a:bc > 02:cf:69:15:81:01, ethertype IPv4 (0x0800), length 242: 10.0.1.100 > 10.10.0.0: ICMP echo reply, id 1024, seq 0, length 208
11:27:11.017448 90:e2:ba:94:2a:bc > 02:cf:69:15:81:01, ethertype IPv4 (0x0800), length 242: 10.0.1.100 > 10.10.0.0: ICMP echo reply, id 53, seq 0, length 208
11:27:11.029226 90:e2:ba:94:2a:bc > 02:cf:69:15:81:01, ethertype IPv4 (0x0800), length 242: 192.168.0.0 > 192.168.1.100: ICMP echo reply, id 1024, seq 0, length 208
11:27:11.040811 90:e2:ba:94:2a:bc > 02:cf:69:15:81:01, ethertype IPv4 (0x0800), length 42: 192.168.0.0.53 > 192.168.1.100.1024: [|domain]
```
[icmp-ipv4-in.pcap.gz](https://github.com/Igalia/snabb/files/575315/icmp-ipv4-in.pcap.gz)

IPv6
```
lab@ubuntu1:~/latest-snabb-binary/snabb/src/program/snabbvmx/tests/end-to-end/data$ tcpdump -n -e -r icmp-ipv6-in.pcap
reading from file icmp-ipv6-in.pcap, link-type EN10MB (Ethernet)
12:16:09.689323 90:e2:ba:94:2a:bc > 02:cf:69:15:81:01, ethertype IPv6 (0x86dd), length 82: 2a02:587:f710::40 > 2a02:587:f700::100: 10.10.0.0.1024 > 10.0.1.100.53: [|domain]
12:16:09.701227 90:e2:ba:94:2a:bc > 02:cf:69:15:81:01, ethertype IPv6 (0x86dd), length 82: 2a02:587:f710::40 > 2a02:587:f700::100: 10.10.0.0.53 > 10.0.1.100.53: [|domain]
12:16:09.713845 90:e2:ba:94:2a:bc > 02:cf:69:15:81:01, ethertype IPv6 (0x86dd), length 282: 2a02:587:f710::40 > 2a02:587:f700::100: 10.10.0.0 > 10.0.1.100: ICMP echo request, id 1024, seq 0, length 208
12:16:09.729578 90:e2:ba:94:2a:bc > 02:cf:69:15:81:01, ethertype IPv6 (0x86dd), length 282: 2a02:587:f710::40 > 2a02:587:f700::100: 10.10.0.0 > 10.0.1.100: ICMP echo request, id 53, seq 0, length 208
12:16:09.741627 90:e2:ba:94:2a:bc > 02:cf:69:15:81:01, ethertype IPv6 (0x86dd), length 282: 2a02:587:f710::40 > 2a02:587:f700::100: 192.168.0.0 > 192.168.1.100: ICMP echo request, id 1024, seq 0, length 208
```
[icmp-ipv6-in.pcap.gz](https://github.com/Igalia/snabb/files/575316/icmp-ipv6-in.pcap.gz)

**Comment by wingo** [comment]
Thanks for the report.  @teknico do you have time for this one?

**Comment by teknico** [comment]
Yes, looking into it.

**Comment by teknico** [comment]
I could reproduce the problem locally using the attached files, thank you @chrgraf. A fix is undergoing review in #547.

**Comment by teknico** [comment]
Automatically closed by Github, feel free to make comments or reopen.

**Comment by chrgraf** [comment]
Dear all,

again many thanks for quick resolution of the issue. Just verified it in the lab and its working nicely!

**version**

```
lab@ubuntu1:~/latest-snabb-binary/snabb-20161107/src/program/snabbvmx/tests/end-to-end/data$ git log
commit 1715122e5b3975ea26da4b7f040b02cccac719d7
Merge: 92640f1 2185e97
Author: Andy Wingo <wingo@pobox.com>
Date:   Mon Nov 7 10:19:14 2016 +0100

    Merge pull request #538 from dpino/rename-counters-var

    Rename counters var
```

**running the check**

```
lab@ubuntu1:~/latest-snabb-binary/snabb-20161107/src/program/snabbvmx/tests/end-to-end/data$ sudo ~/latest-snabb-binary/snabb/src/snabb snabbvmx check -r  ./icmp_snabbvmx-lwaftr-xe1.cfg "./icmp-ipv4-in.pcap" "./icmp-ipv6-in.pcap" "./outv4/outv4.pcap" "./outv6/outv6.pcap" icmp.lua
```

**checking counters ipv6**
Counters claim 5 packets sent out. This is correct, see tcpdump further down

```
lab@ubuntu1:~/latest-snabb-binary/snabb-20161107/src/program/snabbvmx/tests/end-to-end/data$ cat icmp.lua  | grep out | grep pack
   ["out-icmpv4-packets"] = 2,
   ["out-icmpv6-packets"] = 3,
   ["out-ipv4-packets"] = 4,
   ["out-ipv6-packets"] = 5,


lab@ubuntu1:~/latest-snabb-binary/snabb-20161107/src/program/snabbvmx/tests/end-to-end/data$ tcpdump -r outv6/outv6.pcap
reading from file outv6/outv6.pcap, link-type EN10MB (Ethernet)
01:00:00.000000 IP6 2a02:587:f700::100 > 2a02:587:f710::40: ICMP6, destination unreachable, unknown unreach code (5)
    0x0000:  0105 12d7 0000 0000 6000 0000 001c 0440
    0x0010:  2a02 0587 f710 0000 0000 0000 0000 0040
    0x0020:  2a02 0587 f700 0000 0000 0000 0000 0100
    0x0030:  4500 001c 0001 0000 4011 6563 0a0a 0000
    0x0040:  0a00 0164 0035 0035 0008 ea06
01:00:00.000000 IP6 2a02:587:f700::100 > 2a02:587:f710::40: ICMP6, destination unreachable, unknown unreach code (5)
    0x0000:  0105 fbbf 0000 0000 6000 0000 00e4 0440
    0x0010:  2a02 0587 f710 0000 0000 0000 0000 0040
    0x0020:  2a02 0587 f700 0000 0000 0000 0000 0100
    0x0030:  4500 00e4 0001 0000 4001 64ab 0a0a 0000
    0x0040:  0a00 0164 0800 edc0 0035 0000 6161 6161
    0x0050:  6161 6161 6161 6161 6161 6161 6161 6161
    0x0060:  6161 6161 6161 6161 6161 6161 6161 6161
    0x0070:  6161 6161 6161 6161 6161 6161 6161 6161
    0x0080:  6161 6161 6161 6161 6161 6161 6161 6161
    0x0090:  6161 6161 6161 6161 6161 6161 6161 6161
    0x00a0:  6161 6161 6161 6161 6161 6161 6161 6161
    0x00b0:  6161 6161 6161 6161 6161 6161 6161 6161
    0x00c0:  6161 6161 6161 6161 6161 6161 6161 6161
    0x00d0:  6161 6161 6161 6161 6161 6161 6161 6161
    0x00e0:  6161 6161 6161 6161 6161 6161 6161 6161
    0x00f0:  6161 6161 6161 6161 6161 6161 6161 6161
    0x0100:  6161 6161 6161 6161 6161 6161 6161 6161
    0x0110:  6161 6161
01:00:00.000000 IP6 2a02:587:f700::100 > 2a02:587:f710::40: ICMP6, destination unreachable, unknown unreach code (5)
    0x0000:  0105 fbbf 0000 0000 6000 0000 00e4 0440
    0x0010:  2a02 0587 f710 0000 0000 0000 0000 0040
    0x0020:  2a02 0587 f700 0000 0000 0000 0000 0100
    0x0030:  4500 00e4 0001 0000 4001 f763 c0a8 0000
    0x0040:  c0a8 0164 0800 e9f5 0400 0000 6161 6161
    0x0050:  6161 6161 6161 6161 6161 6161 6161 6161
    0x0060:  6161 6161 6161 6161 6161 6161 6161 6161
    0x0070:  6161 6161 6161 6161 6161 6161 6161 6161
    0x0080:  6161 6161 6161 6161 6161 6161 6161 6161
    0x0090:  6161 6161 6161 6161 6161 6161 6161 6161
    0x00a0:  6161 6161 6161 6161 6161 6161 6161 6161
    0x00b0:  6161 6161 6161 6161 6161 6161 6161 6161
    0x00c0:  6161 6161 6161 6161 6161 6161 6161 6161
    0x00d0:  6161 6161 6161 6161 6161 6161 6161 6161
    0x00e0:  6161 6161 6161 6161 6161 6161 6161 6161
    0x00f0:  6161 6161 6161 6161 6161 6161 6161 6161
    0x0100:  6161 6161 6161 6161 6161 6161 6161 6161
    0x0110:  6161 6161
01:00:00.000000 IP6 2a02:587:f700::100 > 2a02:587:f710::40: IP 10.0.1.100.domain > 10.10.0.0.1024: [|domain]
01:00:00.000000 IP6 2a02:587:f700::100 > 2a02:587:f710::40: IP 10.0.1.100 > 10.10.0.0: ICMP echo reply, id 1024, seq 0, length 208
```

many thanks for having this one resolved.
@teknico : thanks for the updated counter documentation as well!

thanks

christian
