### ISSUE TITLE
snabbvmx monitor app missing

### ISSUE THREAD

**Issue by chrgraf** [Igalia/snabbswitch#579]
Dear all,

kindly ask for help.

In the past a "snabb snabbvmx monitor" command was available. Since some time it seemed this part is missing:

```
root@a698fcb53044:/# snabb snabbvmx monitor
Usage:
    snabbvmx check
    snabbvmx lwaftr
    snabbvmx query
    snabbvmx top
```

The command looked like this:

```
root@36f642b78899:/# snabb snabbvmx monitor 10.10.23.23
monitor set to 10.10.23.23


tcpdump -n -i xe0 -s 1500 -e ip

13:45:15.049630 02:cf:69:15:05:00 > 02:44:44:44:44:44, ethertype IPv4 (0x0800), length 608: 10.10.0.0.44032 > 1.1.1.1.12345: UDP, length 558
13:45:15.049631 02:cf:69:15:05:00 > 02:44:44:44:44:44, ethertype IPv4 (0x0800), length 608: 10.10.0.0.44032 > 1.1.1.1.12345: UDP, length 558
13:45:15.049632 02:cf:69:15:05:00 > 02:44:44:44:44:44, ethertype IPv4 (0x0800), length 1514: 10.10.0.0.44032 > 1.1.1.1.12345: UDP, length 1464
13:45:15.049683 46:46:46:46:46:46 > 02:cf:69:15:05:00, ethertype IPv4 (0x0800), length 78: 1.1.1.1.12345 > 10.10.0.0.55296: UDP, length 28
13:45:15.049684 46:46:46:46:46:46 > 02:cf:69:15:05:00, ethertype IPv4 (0x0800), length 78: 1.1.1.1.12345 > 10.10.0.0.55296: UDP, length 28
13:45:15.049686 46:46:46:46:46:46 > 02:cf:69:15:05:00, ethertype IPv4 (0x0800), length 78: 1.1.1.1.12345 > 10.10.0.0.55296: UDP, length 28
13:45:15.049688 46:46:46:46:46:46 > 02:cf:69:15:05:00, ethertype IPv4 (0x0800), length 78: 1.1.1.1.12345 > 10.10.0.0.55296: UDP, length 28
```

Can you kindly have this app added back again?
it was very beneficial for troubleshooting, as it gave "tcpdump" capabilities to lw4o6 translated packets.

thanks

christian

**Comment by wingo** [comment]
I see there is a "snabb lwaftr monitor".  I wonder if that works.  @kbara do you know?

**Comment by dpino** [comment]
@chrgraf @wingo The `monitor` tool, although was originally in snabbvmx, was moved to 'snabb lwaftr' since the tool is also useful for Snabb's lwaftr when running in on-a-stick mode. I discussed that with @mwiget, he said he was OK with having monitor as part of Snabb's lwaftr.

**Comment by chrgraf** [comment]
Hi Diego,

thanks for pointing me to the correct syntax. I can execute the command as you suggested, but I am not able to see the "monitored" packets. Not sure if I am doing it still wrongly or if it is an issue to be fixed.
Environment is the vmx-docker-lwaftr:  
```
git clone --recursive -b v1.1.16 https://github.com/Juniper/vmx-docker-lwaftr
```

Please find my test below

**lwaftr works fine**
I am sending two packets snabbvmx and both get encapped/decapped correctly
``` 
01:08:03.628391 IP 10.0.1.100.17 > 10.10.0.0.1024: UDP, length 4000
01:08:03.628487 IP6 2a02:587:f700::100 > 2a02:587:f710::40: IP 10.0.1.100.17 > 10.10.0.0.1024: UDP, length 4000

01:08:04.148591 IP6 2a02:587:f710::40 > 2a02:587:f700::100: IP 10.10.0.0.1024 > 10.0.1.100.17: UDP, length 1100
01:08:04.148652 IP 10.10.0.0.1024 > 10.0.1.100.17: UDP, length 1100
```

**check which lwaftr instance is handling the traffic**
As I do have 2 lwaftr PID running, I am checking which snabb-instances is handling the traffic
PID 481 is the right one
```
root@dd949a77a71a:/# snabb lwaftr query 481
lwAFTR operational counters (non-zero)
in-ipv4-bytes:    4,583,628
in-ipv4-packets:  1,134  <<< gets +1 
in-ipv6-bytes:    995,244
in-ipv6-packets:  842    <<< gets +1
out-ipv4-bytes:   961,564
out-ipv4-packets: 842
out-ipv6-bytes:   4,628,988
out-ipv6-packets: 1,134
root@dd949a77a71a:/# snabb lwaftr query 481
lwAFTR operational counters (non-zero)
in-ipv4-bytes:    4,587,670
in-ipv4-packets:  1,135
in-ipv6-bytes:    996,426
in-ipv6-packets:  843
out-ipv4-bytes:   962,706
out-ipv4-packets: 843
out-ipv6-bytes:   4,633,070
out-ipv6-packets: 1,135
```

**running the monitor command**
I am executing below command inside the containers shell
```
docker exec -ti lwaftr3-16.2R3 bash
...
root@dd949a77a71a:/# snabb lwaftr monitor 10.10.0.0 481
Mirror address set to '10.10.0.0'
```

**which tap interface to use**
From below output it is my understanding to use xe0 to run the tcpdump against, based on below output "--id xe0".
```
root@dd949a77a71a:/# ps -ef | grep 481
root       481   479 99 Nov18 ?        5-16:05:47 /usr/local/bin/snabb snabbvmx lwaftr --conf snabbvmx-lwaftr-xe0.cfg --id xe0 --pci 0000:81:00.0 --mac 02:cf:69:15:81:00 --sock %s.socket
```

**used xe0 interface does not display any mirrored packets**
As seen in above pcap, the subscribers public Ip is 10.10.0.0 and the monitor shall have displayed those. Below pcap is empty, which is unexpected.
```
root@dd949a77a71a:/# tcpdump -n -i xe0
tcpdump: WARNING: xe0: no IPv4 address assigned
tcpdump: verbose output suppressed, use -v or -vv for full protocol decode
listening on xe0, link-type EN10MB (Ethernet), capture size 65535 bytes
^C
0 packets captured
0 packets received by filter
0 packets dropped by kernel
```

Diego, I know that I have not yet attached enough data to 100% replicate the issue. If more info is required, kindly let me know.

thanks

christian

**Comment by dpino** [comment]
I haven't run the example code but I think the root of the problem is in the command that launches `snabbvmx lwaftr`:

```
$ sudo ./snabb snabbvmx lwaftr --conf snabbvmx-lwaftr-xe0.cfg --id xe0 
   --pci 0000:81:00.0 --mac 02:cf:69:15:81:00 --sock %s.socket
```

In order to inspect mirrored packets, besides running "lwaftr monitor" on a SnabbVMX process, it's necessary too to pass a `--mirror` knob to snabbvmx. Matching packets are copied to the mirror interface. For instance:

```
$ sudo ./snabb snabbvmx lwaftr --conf snabbvmx-lwaftr-xe0.cfg --id xe0 \
   --pci 0000:81:00.0 --mac 02:cf:69:15:81:00 --sock %s.socket --mirror tap0
```

Then monitored packets are copied to interface `tap0`:

```
$ sudo snabb lwaftr monitor 10.10.0.0 xe0
```

Besides PID, it's also possible to refer to a SnabbVMX by its id (in this case xe0, as --id 'xe0' was used to run snabbvmx).

Regarding the tap interface where packets are mirrored, it's necessary to create it manually if it doesn't exist:

```
$ sudo ip tuntap add tap0 mode tap
```

Let me know how it goes. If it doesn't solve the issue I will give it another try.

**Comment by chrgraf** [comment]
Hi Diego, Hi Marcel,

First your proposal below works fine in standalone mode (launching snabb on compute-host directly) - details are below. Thanks for this.
Inside the container based on (git clone --recursive -b v1.1.16 https://github.com/Juniper/vmx-docker-lwaftr) it is not working..
So work is required to make it working in a vmx-docker-lwaftr container. Not sure who needs to do this (jnpr/igalia)

I can file an issue against this, please advise.

Thanks

Christian



Adding tap0

——————————

sudo ip tuntap add tap0 mode tap

sudo ifconfig tap0 up

Launching snabbvmx standalone (note the omitted —sock parm)
———————————————————————
sudo ./usr/local/bin/snabb snabbvmx lwaftr --conf snabbvmx-lwaftr-xe1.cfg --id xe1 --pci 0000:81:00.1 --mac 02:cf:69:15:81:01 --mirror tap0

Launching the mirror
———————————————
sudo usr/local/bin/snabb lwaftr monitor 10.10.0.0 xe1

Tcpdump works nicely on tap0
----------------------------------------------
lab@ubuntu1:~/vmx-docker-lwaftr/tests/tmp$ sudo tcpdump -n -i tap0
tcpdump: WARNING: tap0: no IPv4 address assigned
tcpdump: verbose output suppressed, use -v or -vv for full protocol decode
listening on tap0, link-type EN10MB (Ethernet), capture size 65535 bytes
10:01:26.188024 IP 10.0.1.100.53 > 10.10.0.0.1024: [|domain]
10:01:26.188384 IP6 2a02:587:f700::100 > 2a02:587:f710::40: IP 10.0.1.100.53 > 10.10.0.0.1024: [|domain]
10:01:32.694944 IP 10.0.1.100.53 > 10.10.0.0.1024: [|domain]
10:01:32.695243 IP6 2a02:587:f700::100 > 2a02:587:f710::40: IP 10.0.1.100.53 > 10.10.0.0.1024: [|domain]
^C
4 packets captured
4 packets received by filter
0 packets dropped by kernel


————————————————————

Christian Graf
Senior Consulting Engineer
Telephone +49 5651/336174
Mobile +49 175/2929 167
cgraf@juniper.net
www.juniper.net

Juniper Networks GmbH
Sitz der Gesellschaft / Registered office: Oskar-Schlemmer-Str. 15, 80807 München
Registergericht / Commercial registry: München, HRB 205571
Geschäftsführer / Directors: Johannes Albers, Stephen Byrne, Terrance Floyd Spidell
_________________________________________________________________________

This email contains material that is confidential. The content of this email is for the sole use of the intended recipient(s).
Any review or distribution by persons other than the intended recipient(s) without the express permission of Juniper Networks is strictly prohibited.
If you are not the intended recipient, please contact the sender and delete/destroy all copies of this email and any related attachments.
Juniper does not guarantee the accuracy or completeness of third party materials or information

————————————————————

**Comment by dpino** [comment]
Ping @mwiget. It seems monitoring packets to a mirror interface when SnabbVMX runs inside a docker container is not working correctly. Any thoughts about this?

**Comment by chrgraf** [comment]
Dear all,

I have been further looking into the issue and got it working inside the container - finally according to previous mentioned steps. Key difference opposed to previous steps was to properly kill snabb and launch it manually with the --mirror knob.

**solution in short:**
- per each instance a unique tap-interface is required
- snabb must be launched with the --mirror tap\<x\> knob

**version**
vmx-docker-lwaftr:1.1.19

# details

## adding the tap-interfaces inside the container
one tap-interface  per snabb-instance is required. As mine setup has two snabb-instances I am creating two tap-interfaces

 ```
ip tuntap add tap0 mode tap
ifconfig tap0 up
ip tuntap add tap1 mode tap
ifconfig tap1 up
```

actually as seen below snabb is launched without the --mirror knob
```
root       592   590 99 10:50 ?        00:04:02 /usr/local/bin/snabb snabbvmx lwaftr --conf snabbvmx-lwaftr-xe1.cfg --id xe1 --pci 0000:81:00.1 --mac 02:cf:69:15:81:01 --sock %s.socket
```

## killing snabb and the launcher-scripts (not elegant, but proves its working)

after killing of the launcher-scripts and the running snabb-instances I am launching them manually

```bash
$ cd /tmp
$ /usr/local/bin/snabb snabbvmx lwaftr --conf snabbvmx-lwaftr-xe0.cfg --id xe0 --pci 0000:81:00.0 --mac 02:cf:69:15:81:00 --sock %s.socket --mirror tap1
$ /usr/local/bin/snabb snabbvmx lwaftr --conf snabbvmx-lwaftr-xe1.cfg --id xe1 --pci 0000:81:00.1 --mac 02:cf:69:15:81:01 --sock %s.socket --mirror tap0
```

**result of manual launch**
```
root      1558  1257  0 11:10 ?        00:00:00 /usr/local/bin/snabb snabbvmx lwaftr --conf snabbvmx-lwaftr-xe1.cfg --id xe1 --pci 0000:81:00.1 --mac 02:cf:69:15:81:01 --sock %s.socket --mirror tap1
root      1559  1558 98 11:10 ?        00:01:47 /usr/local/bin/snabb snabbvmx lwaftr --conf snabbvmx-lwaftr-xe1.cfg --id xe1 --pci 0000:81:00.1 --mac 02:cf:69:15:81:01 --sock %s.socket --mirror tap1
root      1565   713  0 11:10 ?        00:00:00 /usr/local/bin/snabb snabbvmx lwaftr --conf snabbvmx-lwaftr-xe0.cfg --id xe0 --pci 0000:81:00.0 --mac 02:cf:69:15:81:00 --sock %s.socket --mirror tap0
root      1566  1565 98 11:10 ?        00:01:45 /usr/local/bin/snabb snabbvmx lwaftr --conf snabbvmx-lwaftr-xe0.cfg --id xe0 --pci 0000:81:00.0 --mac 02:cf:69:15:81:00 --sock %s.socket --mirror tap0
```

### enabling the monitor
```
root@8fc5e821474f:/# snabb lwaftr monitor all 1566
Monitor all
Mirror address set to 'all'

root@8fc5e821474f:/# snabb lwaftr monitor all 1559
Monitor all
Mirror address set to 'all'
```

### running tcpdump
tcpdump runs nicely as seen below
```bash
root@8fc5e821474f:/# tcpdump -n -i tap0
tcpdump: WARNING: tap0: no IPv4 address assigned
tcpdump: verbose output suppressed, use -v or -vv for full protocol decode
listening on tap0, link-type EN10MB (Ethernet), capture size 65535 bytes
11:13:42.394441 IS-IS, L2 Lan IIH, src-id 1001.1100.1000, lan-id 1001.1100.1000.00, prio 64, length 66

root@8fc5e821474f:/# tcpdump -n -i tap1
tcpdump: WARNING: tap1: no IPv4 address assigned
tcpdump: verbose output suppressed, use -v or -vv for full protocol decode
listening on tap1, link-type EN10MB (Ethernet), capture size 65535 bytes
11:14:01.137459 IP 192.168.5.2.54948 > 192.168.5.1.179: Flags [P.], seq 2799591821:2799591840, ack 441224995, win 16384, length 19: BGP, length: 19
11:14:01.246373 IP 192.168.5.1.179 > 192.168.5.2.54948: Flags [.], ack 19, win 16384, options [nop,nop,TS val 3319130466 ecr 0], length 0
```

# Solution

- Kindly have the tap-interfaces (one per instance) created within the container
- launch snabb with the --mirror-knob with each instance using a different tap-interface

thanks

christian

**Comment by mwiget** [comment]
The original version of snabbvmx always connected to a mirror port with the same name as the id given to snabbvmx. The final version added a new parameter '--mirror' that needs to be added to the launch script in the vmx-docker-lwaftr container. 

I'd say the change is needed here: https://github.com/Juniper/vmx-docker-lwaftr/blob/master/launch_snabb.sh#L48, so 

@chrgraf: please open an issue in https://github.com/juniper/vmx-docker-lwaftr and refer to this issue here, then close it  here.

**Comment by chrgraf** [comment]
Dear all,

tracked and worked on here: https://github.com/Juniper/vmx-docker-lwaftr/issues/1

closing this one.

thanks

christian

**Comment by dpino** [comment]
Glad it got solved :+1:

**Comment by chrgraf** [comment]
Thanks Diego for your help and input – this helped alot!

Thanks

Christian

————————————————————

Christian Graf
Senior Consulting Engineer
Telephone +49 5651/336174
Mobile +49 175/2929 167
cgraf@juniper.net
www.juniper.net

Juniper Networks GmbH
Sitz der Gesellschaft / Registered office: Oskar-Schlemmer-Str. 15, 80807 München
Registergericht / Commercial registry: München, HRB 205571
Geschäftsführer / Directors: Johannes Albers, Stephen Byrne, Terrance Floyd Spidell
_________________________________________________________________________

This email contains material that is confidential. The content of this email is for the sole use of the intended recipient(s).
Any review or distribution by persons other than the intended recipient(s) without the express permission of Juniper Networks is strictly prohibited.
If you are not the intended recipient, please contact the sender and delete/destroy all copies of this email and any related attachments.
Juniper does not guarantee the accuracy or completeness of third party materials or information

————————————————————
