### ISSUE TITLE
interactively running "snabb snabbvmx check -r"does  generate an empty outv4.pcap

### ISSUE THREAD

**Issue by chrgraf** [Igalia/snabbswitch#534]
Dear all,

I am running the "snabb snabbvmx check -r" interactively and the outv4.pcap is written empty. As the regenerated counters file is showing ["out-ipv4-packets"] = 2, the outv4.pcap shall have shown at least 2 packets instead of being empty.

**details**

**version**
```
lab@ubuntu1:~/latest-snabb-binary/snabb/src/program/snabbvmx/tests/end-to-end/data$ git log
commit 044dfd838b2f441c59faa5917e1d66ec8733a62c
Merge: 8d43cf2 2729db9
Author: Diego Pino <dpino@users.noreply.github.com>
Date:   Fri Nov 4 05:42:15 2016 +0100

    Merge pull request #528 from dpino/fix-packet-allocation-overflow

    Fix packet allocation overflow
```

**running the check**
```
lab@ubuntu1:~/latest-snabb-binary/snabb/src/program/snabbvmx/tests/end-to-end/data$ sudo ~/latest-snabb-binary/snabb/src/snabb snabbvmx check -r ./icmp_snabbvmx-lwaftr-xe1.cfg "./empty.pcap" "./icmp-ipv6-in.pcap" "./outv4/outv4.pcap" "./outv6/outv6.pcap" ./counters1.lua
loading compiled binding table from ./binding_table.txt.s.o
compiled binding table ./binding_table.txt.s.o is out of date; recompiling.
loading source binding table from ./binding_table.txt.s
nh_fwd4: cache_refresh_interval set to 0 seconds
nh_fwd4: static next_hop_mac 90:e2:ba:94:2a:bc
nh_fwd6: cache_refresh_interval set to 0 seconds
nh_fwd6: static next_hop_mac 90:e2:ba:94:2a:bc
done
```

**checking counters**
```
lab@ubuntu1:~/latest-snabb-binary/snabb/src/program/snabbvmx/tests/end-to-end/data$ cat counters1.lua
return {
   ["drop-all-ipv6-iface-bytes"] = 282,
   ["drop-all-ipv6-iface-packets"] = 1,
   ["drop-no-source-softwire-ipv6-bytes"] = 282,
   ["drop-no-source-softwire-ipv6-packets"] = 1,  <<< expected, 3rd frame is a no-match binding-table packet
   ["in-ipv6-bytes"] = 646,
   ["in-ipv6-packets"] = 3,
   ["out-icmpv6-bytes"] = 330,
   ["out-icmpv6-packets"] = 1,
   ["out-ipv4-bytes"] = 284,
   ["out-ipv4-packets"] = 2,    <<< unequal to zero - outv4.pcap shall contain 2 packets
}
```

**checking outv4.pcap**
As the "out-ipv4-packets"] = 2, the outv4.pcap shall not have been empty.
But as seen, outv4.pcap is empty - hence reporting this as issue:

```
lab@ubuntu1:~/latest-snabb-binary/snabb/src/program/snabbvmx/tests/end-to-end/data$ tcpdump -r outv4/outv4.pcap
reading from file outv4/outv4.pcap, link-type EN10MB (Ethernet)
```

**config-files**
```
lab@ubuntu1:~/latest-snabb-binary/snabb/src/program/snabbvmx/tests/end-to-end/data$ cat ./icmp_snabbvmx-lwaftr-xe1.cfg
return {
  lwaftr = "icmp_snabbvmx-lwaftr-xe1.conf",
  settings = {
  },
  ipv6_interface = {
    ipv6_address = "",
    cache_refresh_interval = 0,
    fragmentation = false,
    mac_address = "90:e2:ba:94:2a:bc",
    next_hop_mac = "90:e2:ba:94:2a:bc",
  },
  ipv4_interface = {
    ipv4_address = "192.168.5.2",
    cache_refresh_interval = 0,
    fragmentation = false,
    mac_address = "90:e2:ba:94:2a:bc",
    next_hop_mac = "90:e2:ba:94:2a:bc",
  },
}

lab@ubuntu1:~/latest-snabb-binary/snabb/src/program/snabbvmx/tests/end-to-end/data$ cat icmp_snabbvmx-lwaftr-xe1.conf
hairpinning = false,
vlan_tagging = false,
binding_table = binding_table.txt.s,
aftr_ipv6_ip = fc00:168:10::2,
aftr_ipv4_ip = 192.168.10.2,
aftr_mac_inet_side = 02:cf:69:15:81:01,
inet_mac = 90:e2:ba:94:2a:bc
aftr_mac_b4_side = 02:cf:69:15:81:01,
next_hop6_mac = 90:e2:ba:94:2a:bc,
ipv4_mtu = 9000,
ipv6_mtu = 9000,
policy_icmpv4_incoming = allow,
policy_icmpv4_outgoing = allow,
policy_icmpv6_incoming = allow,
policy_icmpv6_outgoing = allow,
icmpv6_rate_limiter_n_packets = 300000,
icmpv6_rate_limiter_n_seconds = 4,
```

**binding-table  - please see changed b4-address ::40**
```
lab@ubuntu1:~/latest-snabb-binary/snabb/src/program/snabbvmx/tests/end-to-end/data$ cat binding_table.txt.s
psid_map {
  10.10.0.0  {psid_length=6, shift=10}
  10.10.0.1  {psid_length=6, shift=10}
  10.10.0.10 {psid_length=6, shift=10}
}
br_addresses {
  2a02:587:f700::100,
}
softwires {
  { ipv4=10.10.0.0, psid=1, b4=2a02:587:f710::40 }
  { ipv4=10.10.0.0, psid=2, b4=2a02:587:f710::41 }
  { ipv4=10.10.0.0, psid=3, b4=2a02:587:f710::42 }
  { ipv4=10.10.0.0, psid=4, b4=2a02:587:f710::43 }
}
```

**the input pcap**
The icmp-ipv6-in.pcap contains three packets. First two packets are matching the binding-table, while the last one is not matching the binding-table and shall lead to icmp error-message generation.
For the actual reported issue I am only focussing on the "valid/matching" first packet:
dst-mac 02:cf:69:15:81:01 is matching the config
src IPv4 matching binding-table: 10.10.0.0
matching PSID+1 (port 1024)
correct tunnel-endpoint: 2a02:587:f700::100

```
lab@ubuntu1:~/latest-snabb-binary/snabb/src/program/snabbvmx/tests/end-to-end/data$ tcpdump -r ./icmp-ipv6-in.pcap -e
reading from file ./icmp-ipv6-in.pcap, link-type EN10MB (Ethernet)
10:21:27.660677 90:e2:ba:94:2a:bc (oui Unknown) > 02:cf:69:15:81:01 (oui Unknown), ethertype IPv6 (0x86dd), length 82: 2a02:587:f710::40 > 2a02:587:f700::100: 10.10.0.0.1024 > 10.0.1.100.domain: [|domain]
10:21:27.676714 90:e2:ba:94:2a:bc (oui Unknown) > 02:cf:69:15:81:01 (oui Unknown), ethertype IPv6 (0x86dd), length 282: 2a02:587:f710::40 > 2a02:587:f700::100: 10.10.0.0 > 10.0.1.100: ICMP echo request, id 1024, seq 0, length 208
10:21:27.688771 90:e2:ba:94:2a:bc (oui Unknown) > 02:cf:69:15:81:01 (oui Unknown), ethertype IPv6 (0x86dd), length 282: 2a02:587:f710::40 > 2a02:587:f700::100: 192.168.0.0 > 192.168.1.100: ICMP echo request, id 1024, seq 0, length 208
```

**generate the input-pcap**
```
lab@cgrafubuntu2:~/cg-ubuntu2/testing1.0$ cat test-icmp.py
#!/usr/bin/python

from scapy.all import *
size="a" * 200

e_r=Ether(src='90:e2:ba:94:2a:bc', dst='5c:45:27:15:a0:0d')
e_b=Ether(src='90:e2:ba:94:2a:bc', dst='02:cf:69:15:81:01')
v6=IPv6(src='2a02:587:f710::40',dst='2a02:587:f700::100')
v4_from_internet=IP(src='10.0.1.100',dst='10.10.0.0')
v4_to_internet=IP(dst='10.0.1.100',src='10.10.0.0')
v4_no_match=IP(dst='192.168.1.100',src='192.168.0.0')
request_match=ICMP(type=8, code=0, id=1024)/size
reply_match=ICMP(type=0, code=0, id=1024)/size
udp_match=UDP(sport=1024)
udp_no_match=UDP(sport=53)

for x in range(0,1):
        sendp(e_b/v6/v4_to_internet/udp_match,iface='p4p1')
        sendp(e_b/v6/v4_to_internet/request_match,iface='p4p1')
        sendp(e_b/v6/v4_no_match/request_match,iface='p4p1')
        #sendp(e_b/v4_from_internet/reply_match,iface='p4p1')
        #sendp(e_b/v4_no_match/reply_match,iface='p4p1')
        #sendp(e_b/v4_no_match/udp_match,iface='p4p1')
        #sendp(e_b/v4_from_internet/udp_no_match,iface='p4p1')
```
[icmp-ipv6-in.pcap.gz](https://github.com/Igalia/snabb/files/571169/icmp-ipv6-in.pcap.gz)

Kindly have a look into this issue. If I used wrong syntax, kindly advise

thanks

christian

**Comment by wingo** [comment]
Thanks for the report :)

**Comment by dpino** [comment]
@chrgraf It was a bug indeed (thanks for excellent report, it made easy to reproduce the bug), but not in the lwAFTR but in `snabbvmx check`. We were wrongly forwarding v4 outgoing packets to the v6 output (although packets didn't show up in the outv6.pcap).

If I used "lwaftr check" directly, the output was as expected:

``` bash
$ sudo ./snabb lwaftr check -r icmp_snabbvmx-lwaftr-xe1.conf empty.pcap icmp-ipv6-in.pcap
/tmp/outv4.pcap /tmp/outv6.pcap counters1.lua
```

``` bash
$ sudo tcpdump -qns 0 -e -r /tmp/outv4.pcap 
reading from file /tmp/outv4.pcap, link-type EN10MB (Ethernet)
01:00:00.000000 02:cf:69:15:81:01 > 90:e2:ba:94:2a:bc, IPv4, length 42:
   10.10.0.0.1024 > 10.0.1.100.53: UDP, length 0
01:00:00.000000 02:cf:69:15:81:01 > 90:e2:ba:94:2a:bc, IPv4, length 242: 
   10.10.0.0 > 10.0.1.100: ICMP echo request, id 1024, seq 0, length 208
```

However when using `snabbvmx check` there was nothing in `/tmp/outv4.pcap`. So the error had to be in how `snabbvmx check` setup the app network. The bug is fixed in #535.

**Comment by chrgraf** [comment]
Hi Diego,

thanks for the explanation and timely resolution. Once committed, I will have it verified and get it documented.

thanks

christian

**Comment by chrgraf** [comment]
Good morning.

Just verified this fix. Its working like a charm.

**version**

```
lab@ubuntu1:~/latest-snabb-binary/snabb/src/program/snabbvmx/tests/end-to-end/data$ git log
commit 92640f170b3522ab850de9cb1ae10ada2450ae20
Merge: 54d02b5 caa03b8
Author: Andy Wingo <wingo@pobox.com>
Date:   Mon Nov 7 09:09:40 2016 +0100

    Merge pull request #537 from dpino/increase-qemu-ram

    Increase SnabbVMX nexthop selftest qemu image RAM to 1Gb
...
commit 064393a414fb69c43d35083e010f491142132b54
Author: Diego Pino Garcia <dpino@igalia.com>
Date:   Fri Nov 4 18:28:16 2016 +0100

    Wrongly wrote outgoing v4 packets to v6 link
```

**checking the fix**
With below test we expect two packets seen as IPv4 and one packet in ipv6 out.pcaps see the counters1.lua file.

```
lab@ubuntu1:~/latest-snabb-binary/snabb/src/program/snabbvmx/tests/end-to-end/data$ sudo ~/latest-snabb-binary/snabb/src/snabb snabbvmx check -r ./icmp_snabbvmx-lwaftr-xe1.cfg "./empty.pcap" "./icmp-ipv6-in.pcap" "./outv4/outv4.pcap" "./outv6/outv6.pcap" ./counters1.lua
loading compiled binding table from ./binding_table.txt.s.o
compiled binding table ./binding_table.txt.s.o is up to date.
nh_fwd4: cache_refresh_interval set to 0 seconds
nh_fwd4: static next_hop_mac 90:e2:ba:94:2a:bc
nh_fwd6: cache_refresh_interval set to 0 seconds
nh_fwd6: static next_hop_mac 90:e2:ba:94:2a:bc
done

lab@ubuntu1:~/latest-snabb-binary/snabb/src/program/snabbvmx/tests/end-to-end/data$ cat counters1.lua
return {
   ["drop-all-ipv6-iface-bytes"] = 282,
   ["drop-all-ipv6-iface-packets"] = 1,
   ["drop-no-source-softwire-ipv6-bytes"] = 282,
   ["drop-no-source-softwire-ipv6-packets"] = 1,
   ["in-ipv6-bytes"] = 646,
   ["in-ipv6-packets"] = 3,
   ["out-icmpv6-bytes"] = 330,
   ["out-icmpv6-packets"] = 1, <<<< 1 * IPv6
   ["out-ipv4-bytes"] = 284,
   ["out-ipv4-packets"] = 2,  <<<< 2 * IPv4
}
```

**checking the resulting outv4.pcap**
Shall be two frames

```
lab@ubuntu1:~/latest-snabb-binary/snabb/src/program/snabbvmx/tests/end-to-end/data$ tcpdump -n -r ./outv4/outv4.pcap
reading from file ./outv4/outv4.pcap, link-type EN10MB (Ethernet)
01:00:00.000000 IP 10.10.0.0.1024 > 10.0.1.100.53: [|domain]
01:00:00.000000 IP 10.10.0.0 > 10.0.1.100: ICMP echo request, id 1024, seq 0, length 208
```

**checking the resulting outv6.pcap**
shall be one frame

```
lab@ubuntu1:~/latest-snabb-binary/snabb/src/program/snabbvmx/tests/end-to-end/data$ tcpdump -n -r ./outv6/outv6.pcap
reading from file ./outv6/outv6.pcap, link-type EN10MB (Ethernet)
01:00:00.000000 IP6 2a02:587:f700::100 > 2a02:587:f710::40: ICMP6, destination unreachable, unknown unreach code (5)
    0x0000:  0105 fbbf 0000 0000 6000 0000 00e4 0440
    0x0010:  2a02 0587 f710 0000 0000 0000 0000 0040
    0x0020:  2a02 0587 f700 0000 0000 0000 0000 0100
    0x0030:  4500 00e4 0001 0000 4001 f763 c0a8 0000
    0x0040:  c0a8 0164 0800 e9f5 0400 0000 6161 6161
    0x0050:  6161 6161 6161 6161 6161 6161 6161 6161
    0x0060:  6161 6161 6161 6161 6161 6161 6161 6161
    0x0070:  6161 6161 6161 6161 6161 6161 6161 6161
    0x0080:  6161 6161 6161 6161 6161 6161 6161 6161
    0x0090:  6161 6161 6161 6161 6161 6161 6161 6161
    0x00a0:  6161 6161 6161 6161 6161 6161 6161 6161
    0x00b0:  6161 6161 6161 6161 6161 6161 6161 6161
    0x00c0:  6161 6161 6161 6161 6161 6161 6161 6161
    0x00d0:  6161 6161 6161 6161 6161 6161 6161 6161
    0x00e0:  6161 6161 6161 6161 6161 6161 6161 6161
    0x00f0:  6161 6161 6161 6161 6161 6161 6161 6161
    0x0100:  6161 6161 6161 6161 6161 6161 6161 6161
    0x0110:  6161 6161
```

fix is doing fine. issue can be closed.

thanks

christian

**Comment by wingo** [comment]
Thanks again for the excellent bug report @chrgraf, and thanks to @dpino for the fix!
